arxiv_id,title,authors,categories,published,updated,url,pdf_url,doi,journal_ref,abstract,collected_at
2606.18049v1,ConTex: Reformulating Counterfactual Generation For Time Series Forecasting,Jan Voets; Hasan Tercan; Tobias Meisen; Sebastian Baum,cs.LG,2026-06-16T15:25:12+00:00,2026-06-16T15:25:12+00:00,http://arxiv.org/abs/2606.18049v1,https://arxiv.org/pdf/2606.18049v1,,,"Decision-making with deep learning-based time series forecasting requires not only accurate predictions but also actionable insights. However, current architectures do not inherently provide such information. Specifically, guidance is needed on how current conditions must be modified to shift from a predicted outcome to a desired future scenario. Counterfactual explanations provide a natural framework for this task, as they represent minimal input changes that alter the model's prediction, indicating when and how intervention is required. Existing approaches rely on instance-wise optimization, leading to inconsistency across instances, high computational costs, and limited applicability in real-time settings.   To address these limitations, we reformulate counterfactual generation for time series forecasting as the problem of learning a globally consistent intervention strategy, allowing counterfactuals to be generated through a single shared function. We propose Counterfactual Time Series Explanations (ConTex), a model-agnostic, decomposed architecture comprising a temporal context encoder and a conditional encoder, followed by two heads that capture interventions in terms of temporal relevance and modification strength. This structure overcomes the instability and inconsistency of instance-based approaches by producing targeted, interpretable interventions across time and feature dimensions in a single forward pass, making it suitable for real-time applications.   Across multiple forecasting architectures and benchmark datasets, ConTex achieves state-of-the-art validity while generating sparse counterfactuals that minimize the number of necessary interventions. Additionally, our approach reduces computational cost by at least 12-36x compared to instance-wise generation and supports real-time inference at approximately 0.007 seconds.",2026-06-17T04:18:18.409872+00:00
2606.18043v1,Uncertainty Quantification for Flow-Based Vision-Language-Action Models,Ralf Römer; Maximilian Seeliger; Saida Liu; Ben Sturgis; Marco Bagatella; Daniel Marta; Andreas Krause; Angela P. Schoellig,cs.RO; cs.LG,2026-06-16T15:19:09+00:00,2026-06-16T15:19:09+00:00,http://arxiv.org/abs/2606.18043v1,https://arxiv.org/pdf/2606.18043v1,,,"Vision-language-action models (VLAs) combine vision-language backbones with expressive generative action heads trained via flow matching on large-scale robotic datasets. Despite their strong empirical performance in robotic manipulation, VLAs lack mechanisms to quantify confidence in their predictions and to detect when their actions may be unreliable. This presents a critical limitation for real-world deployment in non-stationary environments, where models inevitably encounter scenarios outside their pretraining distribution and may fail without warning. To address this, we derive an efficient method for quantifying epistemic uncertainty in flow-matching models by leveraging velocity-field disagreement (VFD) across a small ensemble. We successfully use this uncertainty estimate for failure detection during deployment and active fine-tuning of flow-based VLAs. To this end, we propose SAVE, a framework for uncertainty-guided active multitask fine-tuning that reduces the number of costly expert demonstrations required to adapt VLAs to new tasks. Through extensive experiments on the LIBERO benchmark, we demonstrate that VFD yields better-calibrated uncertainty estimates predictive of downstream performance, that VFD achieves strong performance in detecting failures, and that uncertainty-guided data acquisition with SAVE requires at least 22% fewer samples than baselines. In summary, our work shows that quantifying epistemic uncertainty in flow-based VLAs improves both failure awareness and adaptation. Project website: tum-lsy.github.io/uq_vla/.",2026-06-17T04:18:18.409878+00:00
2606.18033v1,When English Isn't the Best Teacher: Source Language Effects in Cross-Lingual In-Context Learning,Fred Philippy; Siwen Guo; Jacques Klein; Tegawendé F. Bissyandé,cs.CL; cs.AI,2026-06-16T15:09:42+00:00,2026-06-16T15:09:42+00:00,http://arxiv.org/abs/2606.18033v1,https://arxiv.org/pdf/2606.18033v1,,,"Cross-lingual transfer in multilingual NLP has been widely explored in supervised fine-tuning contexts, where factors like data availability and linguistic similarity largely determine transfer quality. As the field shifts toward few-shot In-Context Learning (ICL), it is often presumed that insights from fine-tuning carry over unchanged. Yet this assumption has not been rigorously evaluated, leaving open the question of how to choose source languages for cross-lingual ICL. We conduct a broad empirical study of cross-lingual transfer in ICL spanning seven tasks, six models, and a typologically diverse set of languages. We further analyze language confusion, a key obstacle for generative tasks in cross-lingual ICL. Our results show that conventional fine-tuning-based expectations do not consistently apply in the ICL regime and point to alternative heuristics for selecting source languages effectively.",2026-06-17T04:18:18.409884+00:00
2606.18032v1,INI-VPINN: A Variational Physics-Informed Neural Network with Implicit Neumann and Interface Handling for Multi-Material Domains with Geometric Singularities,Shayan Dodge; Alessandro Formisano; Sami Barmada,math.NA; cs.LG; physics.comp-ph,2026-06-16T15:06:15+00:00,2026-06-16T15:06:15+00:00,http://arxiv.org/abs/2606.18032v1,https://arxiv.org/pdf/2606.18032v1,,,"We propose a new weak-form Physics-Informed Neural Network approach (named INI-VPINN). INI-VPINN naturally incorporates Neumann boundary and interface conditions into the variational formulation. It removes the need for additional loss terms or multiple subdomain networks. This framework employs compact support weighting functions and integration by parts to implicitly impose flux and continuity constraints. In this way, it implicitly ensures physical consistency across material boundaries. The proposed method is tested on Poisson and Laplace problems with sharp interfaces and complex geometries. Results show that, compared with several other Physics Informed Neural Networks-based formulations, the INI-VPINN consistently achieves higher accuracy, smoother and faster convergence. The proposed framework provides a general approach for solving multimaterial problems with complex geometries and mixed Neumann-Dirichlet boundary conditions using neural networks. The implementation is publicly available in a GitHub repository.",2026-06-17T04:18:18.409888+00:00
2606.18024v1,Catastrophic Forgetting is Low-Rank: A Function-Space Theory for Continual Adaptation,Ido Nitzan Hidekel; Dan Raviv,cs.LG; cs.AI,2026-06-16T15:03:37+00:00,2026-06-16T15:03:37+00:00,http://arxiv.org/abs/2606.18024v1,https://arxiv.org/pdf/2606.18024v1,,,"Catastrophic forgetting in continual adaptation is usually studied through parameter drift, replay, or distillation, but these views do not identify which output-space directions are vulnerable. We give a function-space account in the NTK regime: new-task training induces old-task prediction drift through the cross-task kernel, yielding a closed-form predictor for the forgetting vector before any new-task gradient step. In frozen-backbone linear-head PEFT-CL, where the model is linear in the trainable parameters, the predictor is exact up to numerical precision; for nonlinear adapters/full fine-tuning, it is a local NTK approximation. The same expression reveals that forgetting concentrates in a small number of old-task NTK eigenmodes and under frozen linear heads gives a Kronecker scaling rule for the vulnerable rank. These results clarify the relation to prior NTK-overlap theory, explain why parameter-space regularizers can miss output-space interference, and motivate a targeted spectral regularizer.",2026-06-17T04:18:18.409893+00:00
2606.18023v1,LoopCoder-v2: Only Loop Once for Efficient Test-Time Computation Scaling,Jian Yang; Shawn Guo; Wei Zhang; Tianyu Zheng; Yaxin Du; Haau-Sing Li; Jiajun Wu; Yue Song; Yan Xing; Qingsong Cai; Zelong Huang; Chuan Hao; Ran Tao; Xianglong Liu; Wayne Xin Zhao; Mingjie Tang; Weifeng Lv; Ming Zhou; Bryan Dai,cs.LG; cs.AI,2026-06-16T15:03:05+00:00,2026-06-16T15:03:05+00:00,http://arxiv.org/abs/2606.18023v1,https://arxiv.org/pdf/2606.18023v1,,,"Looped Transformers scale latent computation by repeatedly applying shared blocks, but sequential looping increases latency and KV-cache memory with the loop count. Parallel loop Transformers (PLT) alleviate this cost through cross-loop position offsets (CLP) and shared-KV gated sliding-window attention, making loop count a practical design choice. We therefore study PLT loop-count selection through a gain--cost view: an extra loop may refine representations, but CLP also introduces a positional mismatch at each loop boundary. We instantiate this study by training LoopCoder-v2, a family of 7B PLT coders with different loop counts, from scratch on 18T tokens, followed by matched instruction tuning and evaluation. Empirically, the two-loop variant delivers broad gains over the non-looped baseline across code generation, code reasoning, agentic software engineering, and tool-use benchmarks, improving SWE-bench Verified from 43.0 to 64.4 points and Multi-SWE from 14.0 to 31.0 points. In contrast, variants with three or more loops regress, revealing a strongly non-monotonic loop-count effect. Our diagnostics show that loop 2 provides the main productive refinement, while later loops yield diminishing, oscillatory updates and reduced representational diversity. Because the CLP-induced mismatch remains roughly fixed as refinement gains shrink, the offset cost increasingly dominates. This gain--cost trade-off explains PLT's saturation at two loops and provides diagnostics for loop-count selection.",2026-06-17T04:18:18.409901+00:00
