arxiv_id,title,authors,categories,published,updated,url,pdf_url,doi,journal_ref,abstract,collected_at
2606.18106v1,Deep Reinforcement Learning for Minimum Zero-Forcing Sets,Steve Halley; Maurício Gruppi,cs.LG,2026-06-16T16:07:20+00:00,2026-06-16T16:07:20+00:00,http://arxiv.org/abs/2606.18106v1,https://arxiv.org/pdf/2606.18106v1,,,"This paper explores the problem of finding the minimum zero-forcing set on undirected graphs and proposes an adapted machine-learning framework to solve the problem. The minimum zero-forcing set problem is a graph coloring problem where the color of an initial set of nodes propagates throughout a network. The set of nodes is zero-forcing if it forces all uncolored nodes to change color under the constraint of the color-change rule. There are several applications to this problem across different domains such as network science, network control, and designing logical circuits. Finding the minimum zero-forcing set is shown to be NP-hard. We propose a reinforcement learning framework, SD-ZFS, that adapts the S2V-DQN architecture to the ZFS problem. We train several models on this adapted framework and analyze the performance across graph datasets that have varying structures. We evaluate how the models trained on the framework generalize, scale, and transfer to different network types. The results demonstrate the effectiveness of the framework when compared against the optimal solution and greedy heuristic. We provide further insight into how the ZFS problem can be solved through machine-learning and the influence of network structure on the problem.",2026-06-17T04:18:18.409798+00:00
2606.18105v1,OmniPlan: An Adaptive Framework for Timely and Near-Optimal Network Planning Optimization,Longlong Zhu; Jiashuo Yu; Zedi Chen; Yuhan Wu; Zhifan Jiang; Yuchen Xian; Yimeng Liu; Jiajie Su; Shaopeng Zhou; Xingyuan Li; Hongyan Liu; Xuan Liu; Dong Zhang; Chunming Wu; Xiang Chen,cs.NI; cs.LG,2026-06-16T16:06:51+00:00,2026-06-16T16:06:51+00:00,http://arxiv.org/abs/2606.18105v1,https://arxiv.org/pdf/2606.18105v1,,,"Network planning optimization is a fundamental problem across diverse domains, including transportation systems, communication networks, and power grids. It requires simultaneous optimization of multiple competing objectives under complex constraints. Existing network planning optimization frameworks rely on mixed integer programming (MIP) solvers, heuristics, and deep reinforcement learning (DRL) models to compute planning decisions. However, they lack effective adaptability to diverse and dynamic user intents, thus leading to the trade-off between execution time and optimality. In this paper, we propose OmniPlan, an adaptive framework that achieves both timeliness and near-optimality in network planning optimization. To achieve the adaptability lacking in existing solutions, OmniPlan employs a large language model (LLM)-based interpreter to convert heterogeneous natural-language intents into a unified and quantifiable user-preference vector. Then it employs a mixture-of-experts architecture that integrates MIP solvers, heuristics, and DRL models as specialized experts, where OmniPlan adapts to diverse intents by dynamically selecting timely and near-optimal experts. Finally, it incorporates a DRL-based expert configuration module that fine-tunes optimization objective weights to align planning decisions with user-specific preferences. We evaluate OmniPlan with a representative real-world workload, i.e., distributed machine learning (ML), where we leverage OmniPlan to offload a wide spectrum of ML inference tasks, e.g., decision trees, SVM, naive Bayes, XGBoost, and random forests, onto a network of hardware devices. Our experiments on a real-world testbed indicate that OmniPlan achieves near-optimal and low-execution-time offloading for real-world ML inference tasks, reducing latency by up to 97.8\% and network device resource consumption by up to 11.5\%.",2026-06-17T04:18:18.409803+00:00
2606.18098v1,IsabeLLM: Automated Theorem Proving Applied to Formally Verifying Consensus,Elliot Jones; William Knottenbelt,cs.AI,2026-06-16T16:00:14+00:00,2026-06-16T16:00:14+00:00,http://arxiv.org/abs/2606.18098v1,https://arxiv.org/pdf/2606.18098v1,,,"Advances in Artificial Intelligence (AI) have led AI for Theorem Proving to become a promising means of formally verifying computer systems. Whilst formal verification is traditionally reserved for safety-critical systems due to the required amount of expertise and effort, AI can help to automate a large amount of this workload and make it far more accessible. Blockchain-based systems are becoming increasingly popular and are frequently targeted by malicious actors, often resulting in huge financial losses, highlighting the need to better verify these systems and mitigate vulnerabilities. Arguably the most important component of these systems is the consensus protocol, which allows nodes to agree on decisions in a potentially adversarial environment. In this paper, we improve upon IsabeLLM, the automated theorem proving tool in Isabelle. Namely, we implement a Retrieval-Augmented Generation framework, Error tracing and counterexample generation for improved context supplied to the Large Language Model. Compatibility with the latest version of Isabelle and Sledgehammer is also implemented for improved efficiency. We compare the performance of the two versions of IsabeLLM in their ability to complete the verification of Bitcoin's Proof of Work consensus.",2026-06-17T04:18:18.409807+00:00
2606.18096v1,S4oP: Operator-level Pruning of Structured State Space Models for Resource-Constrained Devices,Marco Deano; Filippo Ziche; Nicola Bombieri,cs.LG; cs.AI; cs.DC,2026-06-16T15:59:10+00:00,2026-06-16T15:59:10+00:00,http://arxiv.org/abs/2606.18096v1,https://arxiv.org/pdf/2606.18096v1,,,"Structured State Space Models (SSMs), including the S4 and S4D architectures, have recently emerged as powerful alternatives to attention-based models for capturing long-range dependencies in sequential data. Despite their strong empirical performance, deploying these models in time- and resource-constrained settings remains challenging due to their computational and memory demands. In this paper, we propose a novel incremental, operator-level pruning approach for S4- and S4D-based models that significantly reduces inference cost while preserving predictive performance. To the best of our knowledge, this is the first work to systematically investigate structured operator pruning for SSMs. Our method progressively prunes model operators by interleaving structured masking with fine-tuning, while jointly monitoring accuracy and inference latency. We implement this approach within a unified training and evaluation framework that enables systematic exploration of efficiency-accuracy trade-offs. Experiments across multiple benchmark datasets show that pruning up to 70% of the model operators preserves the performance of the original models in most cases, while substantially reducing inference latency. These results demonstrate that structured operator pruning is an effective and previously unexplored strategy for improving the efficiency of SSMs and facilitate their deployment in practical, resource-constrained scenarios.",2026-06-17T04:18:18.409812+00:00
2606.18089v1,From Reasoning Traces to Reusable Modules: Understanding Compositional Generalization in Language Model Reasoning,Lingjing Kong; Xin Liu; Guangyi Chen; Martin Q. Ma; Xiangchen Song; Yuekai Sun; Mikhail Yurochkin; Taylor W. Killian; Ruslan Salakhutdinov; Kun Zhang; Eric P. Xing; Zhengzhong Liu,cs.LG,2026-06-16T15:55:28+00:00,2026-06-16T15:55:28+00:00,http://arxiv.org/abs/2606.18089v1,https://arxiv.org/pdf/2606.18089v1,,,"Post-training pipelines that combine supervised fine-tuning (SFT) with reinforcement learning (RL) have emerged as the key recipe for transforming large language models (LLMs) into robust reasoners. We argue that this combined success is driven by compositional generalization, which we formalize through a hierarchical latent selection model. In this framework, reasoning traces are generated by a cascade of discrete latent selection variables corresponding to reusable atomic modules, including both skills (local operations) and routing mechanisms (how intermediate information is selected, reused, and composed). Within this model, we theoretically show that SFT and RL play asymmetric, complementary roles: SFT supplies the raw module materials in compositional traces, and RL decomposes those traces to identify the latent atomic modules and enable compositional generalization. We design controlled experiments to validate this theory. Our results demonstrate that RL can extract atomic modules from compound traces supplied by SFT and recombine them to solve new configurations. Moreover, we find that training on compound traces yields stronger generalization than training on isolated atomic modules. Finally, we investigate the relationship between SFT and RL data and identify an effective protocol in which SFT ensures coverage of all atomic modules through compositional traces, while RL focuses on novel compositions outside the SFT support to drive exploration.",2026-06-17T04:18:18.409819+00:00
2606.18080v1,Edge Flow: A Tractable and Predictive Continuous-Time Model for Gradient Descent at the Edge of Stability,Pierre Marion,cs.LG,2026-06-16T15:45:47+00:00,2026-06-16T15:45:47+00:00,http://arxiv.org/abs/2606.18080v1,https://arxiv.org/pdf/2606.18080v1,,,"Gradient descent in deep learning may operate at the edge of stability (EoS), a regime in which the largest eigenvalue of the loss Hessian hovers near the stability threshold $2/η$, where $η$ is the learning rate. Classical analysis tools such as gradient flow and the descent lemma do not apply here, motivating the search for a continuous-time model valid at EoS. We propose Edge Flow, a system of three coupled ordinary differential equations that provides a tractable, faithful, and predictive model of gradient descent dynamics at EoS. Edge Flow decomposes the dynamics into a center, an oscillation direction, and an oscillation magnitude. The center follows a modified gradient flow on a symmetrized loss; the direction tracks a top eigenvector of the Hessian via Rayleigh quotient dynamics; and the magnitude grows or decays exponentially depending on whether the sharpness exceeds or falls below the threshold $2/η$. Crucially, sharpness stabilization emerges from the coupled dynamics via a self-stabilization feedback loop. Discretizing Edge Flow only requires two gradient evaluations and one Hessian--vector product at each iteration. We demonstrate empirically that Edge Flow tracks the dynamics of gradient descent at least as faithfully as previously proposed continuous-time EoS models, while in addition resolving the oscillation of the sharpness at the onset of EoS, and that it provides a principled framework for understanding and mitigating instabilities in this regime.",2026-06-17T04:18:18.409826+00:00
2606.18075v1,A Unified Framework for Context-Aware and Relation-Aware Graph Retrieval-Augmented Generation,Haoyang Zhong; Yifei Sun; Antong Zhang; Chunping Wang; Lei Chen; Yang Yang,cs.AI,2026-06-16T15:44:10+00:00,2026-06-16T15:44:10+00:00,http://arxiv.org/abs/2606.18075v1,https://arxiv.org/pdf/2606.18075v1,10.1145/3774904.3792720,,"Retrieval-Augmented Generation (RAG) has emerged as a paradigm for enhancing large language models (LLMs) with external knowledge, yet existing graph-based methods face a fundamental limitation: entity-centric and chunk-centric approaches operate on representations anchored to original text without true knowledge fusion. While entity-centric methods connect logically related content and chunk-centric methods preserve context, both retrieve information separately through similarity search, missing emergent understanding from their synthesis. In this paper, we propose HyGRAG, a hierarchical graph RAG framework that transcends source documents by addressing three core challenges: constructing summaries that genuinely integrate contextual and relational information, leveraging these synthesized representations to access emergent knowledge during retrieval, and efficiently updating hierarchical structures for dynamic corpora. Specifically, we design hierarchical index structures over hybrid graphs with both chunk and entity nodes, then iteratively cluster them and generate LLM-based summaries. Then, we design context and relation-aware retrieval that searches across all abstraction levels while expanding through community membership. Moreover, we enable dynamic knowledge update through attachment-based algorithms with only local re-summarization. Experimental results show that HyGRAG improves the average accuracy of multi-hop reasoning tasks by 9.7%, while maintaining reasonable efficiency.",2026-06-17T04:18:18.409831+00:00
2606.18074v1,Tensor-based second-order causal discovery,Nathan Ouyang; Kexin Wan; Anna Seigal,stat.ML; cs.LG; stat.ME,2026-06-16T15:43:44+00:00,2026-06-16T15:43:44+00:00,http://arxiv.org/abs/2606.18074v1,https://arxiv.org/pdf/2606.18074v1,,,"Causal discovery seeks to uncover the causal dependencies among variables. For this purpose, we propose an algorithm called Tensor-based Second-order Causal Discovery (TSCD). Its input is a tensor obtained from the covariance matrices of observational and interventional data. Assuming the causal dependencies follow a linear structural equation model on a directed acyclic graph (DAG), TSCD outputs the DAG and the functions on its edges, requiring only that the noise variables are uncorrelated. We also implement a version of the approach for nonlinear models. Our focus on second-order statistics (via the covariance matrices) is motivated by their statistical and computational efficiency relative to higher-order moments, their identifiability relative to first-order statistics, and that they work regardless of whether the variables are Gaussian. We show that TSCD has identifiable causal order and parameters from a number of interventions that is logarithmic in the number of variables. Experiments show that TSCD is robust to noise, competitive with existing methods, and scales to hundreds of variables.",2026-06-17T04:18:18.409835+00:00
2606.18071v1,Volterra Generative Models,Yusen Jia; Bingyan Han,cs.LG; cs.AI,2026-06-16T15:40:09+00:00,2026-06-16T15:40:09+00:00,http://arxiv.org/abs/2606.18071v1,https://arxiv.org/pdf/2606.18071v1,,,"Score-based diffusion models typically use Brownian perturbations, which provide tractable reverse-time dynamics but impose memoryless noising. We introduce Volterra generative models, a continuous-time score-based framework whose forward process injects path-dependent noise through fractional kernels. To handle the non-Markovian and non-semimartingale dynamics, we construct finite-dimensional Markovian lifts using Gaussian quadrature in both regimes and a hybrid finite-difference exponential approximation in the smooth regime. We prove squared error bounds, derive an augmented linear-Gaussian forward process, and show that the learning can remain data-dimensional by considering residual states and analytic auxiliary Gaussian scores. We also identify covariance and reverse-time degeneracies caused by shared Brownian factors and signed smooth-regime weights. The degeneracy motivates stabilized conditioning and, for stiff larger lifts, a Gaussian-bridge reconstruction sampler. Experiments on MNIST and CIFAR-10 show that persistent fractional perturbations with small Markovian lifts can improve score-based generation on MNIST and provide a promising extension to natural images, while the bridge sampler provides a stability mechanism for larger lifts.",2026-06-17T04:18:18.409839+00:00
2606.18068v1,Agentic AI-based Framework for Mitigating Premature Diagnostic Handoff and Silent Hallucination in Healthcare Applications,Divyansh Srivastava; Shreya Ghosh; Anshul Verma; Rajkumar Buyya,cs.AI,2026-06-16T15:39:19+00:00,2026-06-16T15:39:19+00:00,http://arxiv.org/abs/2606.18068v1,https://arxiv.org/pdf/2606.18068v1,,,"Recent advances in Large Language Models (LLMs) and multi-agent systems have driven the rise of Agentic AI, showing promise for medical reasoning. However, open-ended conversational agents remain prone to two critical failure modes: premature diagnostic handoff and silent clinical hallucinations that may go undetected before reaching the patient. In this work, we propose a multi-agent framework that addresses both issues by replacing ``LLM-as-a-judge'' routing with deterministic orchestration constraints. The framework incorporates two safety mechanisms. First, a neuro-symbolic state-tracking gate enforces completeness of the OLDCARTS clinical protocol (Onset, Location, Duration, Character, Aggravating/Alleviating factors, Radiation, Timing, and Severity) by blocking diagnostic transitions until all required dimensions are collected. Second, an epistemic uncertainty quantification (UQ) gate computes semantic entropy (H) across K=5 independent diagnostic samples to identify and intercept divergent outputs before delivery.   We evaluate the system using simulated patient agents powered by the llama-3.1-70b-instruct model on 150 test cases. The full architecture achieves 49.3% diagnostic precision, representing an absolute improvement of 11.3 percentage points over an unconstrained baseline. Additionally, we observe a statistically significant negative correlation (r = -0.181, p < 0.05) between OLDCARTS completeness (σ) and semantic entropy (H), suggesting that structured information gathering is associated with reduced diagnostic uncertainty.",2026-06-17T04:18:18.409844+00:00
2606.18066v1,NoiseTilt: Noise-Tilted Reverse Kernels for Diffusion Reward Alignment,Jisung Hwang; Yunhong Min; Jaihoon Kim; I-Chao Shen; Minhyuk Sung,cs.LG,2026-06-16T15:38:44+00:00,2026-06-16T15:38:44+00:00,http://arxiv.org/abs/2606.18066v1,https://arxiv.org/pdf/2606.18066v1,,,"We introduce the Noise-Tilted Reverse Kernel (NTRK), a reward-guided diffusion sampler that injects reward gradients through the noise term, leaving the pretrained reverse kernel unchanged and requiring only a single sample per step. Reward-guided sampling at inference time has greatly expanded the versatility of pretrained diffusion models. Yet existing methods face a trade-off. Gradient-based guidance shifts the reverse mean, steering generation but pushing intermediate states outside the region that the model was trained on and degrading quality. Search-based methods preserve quality but gain no gradient signal. No prior method achieves both. NTRK resolves this by keeping the reverse mean fixed and biasing the noise term toward high reward. We introduce a whitening operator, the central mechanism behind NTRK, that makes the reward gradient safe to inject as noise without losing its guiding signal. Across various reward alignment tasks, NTRK outperforms recent state-of-the-art baselines without losing sample quality. Remarkably, on aesthetic generation, NTRK surpasses the reward of the best baseline at 500 NFEs using only 25 NFEs, a 20$\times$ reduction in compute.",2026-06-17T04:18:18.409849+00:00
2606.18063v1,When LLMs Analyze Scars: From Images to Clinically-Meaningful Features,Ruman Wang; Hangting Ye,cs.CV; cs.AI; cs.LG,2026-06-16T15:38:06+00:00,2026-06-16T15:38:06+00:00,http://arxiv.org/abs/2606.18063v1,https://arxiv.org/pdf/2606.18063v1,,,"Medical image classification faces a fundamental dilemma: while deep learning models achieve remarkable performance at scale, real-world clinical scenarios often suffer from severe data scarcity due to annotation costs, privacy constraints, and disease rarity. This challenge is particularly pronounced in pathological scar classification, where differentiating keloids from hypertrophic scars requires subtle expert knowledge and labeled images are extremely limited. We propose a novel paradigm that repositions large language models (LLMs) as knowledge-driven feature engineers rather than end-to-end classifiers. We call this framework ScaFE (Scar Feature Engineering). Our key insight is that LLMs encode rich medical knowledge that can be externalized as executable feature extraction code, enabling the transformation of high-dimensional images into low-dimensional, clinically interpretable representations. Specifically, we prompt an LLM with established scar assessment criteria to generate deterministic Python code that extracts features aligned with clinical scoring systems such as the Vancouver Scar Scale. Our approach offers three key advantages: (1) data efficiency, achieving robust performance with limited training samples by decoupling knowledge acquisition from statistical learning; (2) privacy preservation, as raw images are processed locally without exposure to external LLMs; and (3) interpretability, through explicit features grounded in clinical reasoning. Extensive experiments on scar classification demonstrate that our method consistently outperforms end-to-end deep learning baselines or using LLMs as black-box classifiers under limited data conditions, establishing a promising direction for integrating LLMs into data-efficient and clinically transparent medical AI systems.",2026-06-17T04:18:18.409853+00:00
2606.18062v1,Security and Privacy Prompts in the Wild: What Users Ask LLMs and How LLMs Respond,Hobin Kim; Xiaoyuan Wu; Omer Akgul; Lujo Bauer; Nicolas Christin,cs.CL; cs.AI; cs.CR; cs.HC,2026-06-16T15:37:25+00:00,2026-06-16T15:37:25+00:00,http://arxiv.org/abs/2606.18062v1,https://arxiv.org/pdf/2606.18062v1,,,"Large language models (LLMs) are widely used to fulfill users' information needs; users ask LLMs about the weather, pose educational questions, and consult them for legal assistance. One particularly understudied area is digital security and privacy (S&P), where users may seek LLMs' help on how to secure their online accounts or protect their computers from cyber attacks. To the best of our knowledge, no prior study has collected or analyzed the S&P questions users ask LLMs; prior research on LLM response quality relied on expert-authored S&P misconceptions or FAQs rather than user queries. Drawing from WildChat, a dataset of 3.2M user-LLM conversations collected in the wild, our study identifies 14,727 S&P prompts and categorizes them into nine categories covering a wide range of S&P topics. From the S&P prompts, we sampled 450 and performed a thematic analysis to characterize the S&P questions users ask LLMs. Separate from the thematic analysis, we curated 270 advice-seeking S&P prompts, where users ask for recommendations, guidance, or specific S&P information. We measured LLM response quality and consistency when posing the prompt to LLMs 10 times. We found that commercial LLMs outperform open-weight models (GPT 5.5 provided ""good enough"" responses on 98% of prompts; Llama 4 on 47%). However, among prompts that received high-quality responses on average, commercial models sometimes produce contradictory responses across runs, risking confusing or misleading users.",2026-06-17T04:18:18.409860+00:00
2606.18060v1,PseudoBench: Measuring How Agentic Auto-Research Fuels Pseudoscience,Xinyang Liao; Lingyu Li; Huacan Liu; Tianle Gu; Yang Yao; Tong Zhu; Yan Teng; Yingchun Wang,cs.AI; cs.CL,2026-06-16T15:37:02+00:00,2026-06-16T15:37:02+00:00,http://arxiv.org/abs/2606.18060v1,https://arxiv.org/pdf/2606.18060v1,,,"As Large Language Model based agents enter autonomous scientific research, their ability to resist pseudoscience becomes increasingly important. Otherwise, such systems may rapidly generate plausible yet misleading studies that contaminate academic literature and erode trust in science. We present PseudoBench, an adversarial benchmark for evaluating whether agentic auto-research systems can identify and resist pseudoscientific narratives. PseudoBench contains 200 curated pseudoscientific claim-evidence pairs across five domains and evaluates agents through an end-to-end research pipeline from experiments to writing. Testing seven state-of-the-art agents, we find that current systems readily produce persuasive reports that align with pseudoscientific premises with near-zero refusal rates and the highest resistance of only 27.4%. Stronger agents risk packaging pseudoscience in more sophisticated scientific language, increasing its apparent credibility. These findings reveal an alarming capacity to fuel pseudoscience, calling for scientific alignment before widespread deployment.",2026-06-17T04:18:18.409865+00:00
