arxiv_id,title,authors,categories,published,updated,url,pdf_url,doi,journal_ref,abstract,collected_at
2606.18186v1,Kolmogorov Regression for Robust Diffusion Policies,Lekan Molu,cs.LG; cs.AI,2026-06-16T17:18:54+00:00,2026-06-16T17:18:54+00:00,http://arxiv.org/abs/2606.18186v1,https://arxiv.org/pdf/2606.18186v1,,,"Finite-dimensional (FD) diffusion policies exhibit temporal drift owing to discretization artifacts that degrade long-horizon performance (when deployed on physical systems). We introduce a backward Kolmogorov equation that lifts diffusion policies to a Cameron-Martin space -- a subset of the Hilbert space. Essentially, replacing stochastic score matching with a deterministic boundary-value PDE problem. Our core innovation thrives on Gaussian measure theory whereupon the diffusion noise covariance operator is realized from a colored noise distribution which prescribes a notion of regularity on samples from the model at inference time. We train the diffusion model with a derived precision-weighted Cameron- Martin loss and a Kolmogorov residual is introduced as a PDE diagnostic during inference. These substitutions yield (i) convergence guarantees where the bound's constants depend on the effective rank of the kernel rather than action dimension, (ii) improved trajectory regularity via spectral weighting, and (iii) a deterministic failure detector without reward signals. Validation across two application domains demonstrates substantial improvements: on the PushT manipulation benchmark, the Cameron-Martin loss achieves a 17% improvement in maximum episode reward (0.95 vs. 0.78 for MSE) and 67.6% reduction in inter-step drifts during inference via the introduced residual magnitude. Similarly, on a 6-station manufacturing line with constant work-in-process (CONWIP) flow control, we achieve 28.4% lower RMSE than classical LSTM baselines; a high starvation-event recall (1.0 in test cycles), and effective bottleneck identification (Precision@1 = 1.0 in test set, 13x signal-to-noise ratio). We then certify the dispatch policies with Hamilton-Jacobi reachability theory which reduces deadlock events by 96% compared to uncontrolled dispatch over 100 simulated runs (351 events prevented).",2026-06-17T04:18:18.409718+00:00
2606.18183v1,A Diffusion Approximation for Temporal-Difference Learning with Linear Features under Markovian Noise,M. Forzo; E. Monzio Compagnoni; A. Russo; A. Pacchiano,stat.ML; cs.LG; math.PR,2026-06-16T17:16:52+00:00,2026-06-16T17:16:52+00:00,http://arxiv.org/abs/2606.18183v1,https://arxiv.org/pdf/2606.18183v1,,,"Temporal difference (TD) learning with linear function approximation is a core method for policy evaluation. Its classical continuous-time description is an ordinary differential equation (ODE), which captures the asymptotic mean dynamics but neglects stochastic fluctuations determining the error floor. We introduce a stochastic differential equation (SDE) approximation for linear TD(0) under Markovian noise. The resulting model distinguishes the contraction dynamics governed by the projected Bellman operator from the influence of Markovian sampling. As a consequence, the model explains the constant-stepsize error floor through the interaction between Markovian long-run covariance and the contraction geometry of the projected Bellman operator.",2026-06-17T04:18:18.409725+00:00
2606.18181v1,"IUU+DB: Tracking Illegal, Unreported, and Unregulated Fishing, Seafood Fraud, and Labor Abuse through LLM-driven Information Extraction",Henry Bodwell; Hong Yang; John C. Simeone; Kelvin Gorospe; Bella Sullivan; Lana Huang; Jessica Gephart; Sandy Aylesworth; Molly Masterton; Naren Ramakrishnan,cs.IR; cs.AI; cs.CY,2026-06-16T17:16:05+00:00,2026-06-16T17:16:05+00:00,http://arxiv.org/abs/2606.18181v1,https://arxiv.org/pdf/2606.18181v1,,,"Illegal, unreported, and unregulated fishing (IUU) traditionally refers to fishing activities that violate applicable laws or occur in areas that lack applicable laws. We propose the term IUU+ to capture a broader suite of fisheries sector environmental and associated supply chain trade-related crimes and behaviors. Although IUU+ activity is widely recognized as a serious threat to marine ecosystems, markets, and livelihoods, a quantitative understanding of these incidents, e.g., their frequency, geography, species, actors, and patterns in the type of illicit activity, remains difficult to obtain. We propose IUU+DB, a large language model driven system for building a global incident database of IUU+ activity. The system ingests heterogeneous documents, classifies whether they describe relevant incidents, extracts key data elements such as actors, locations, species, vessels, violations, and enforcement outcomes, and supports deduplication and trend analysis. Case studies and validation results show that IUU+DB can help organize fragmented evidence, surface geographic and behavioral hotspots, support fisheries-domain specific research in academia and non-government organizations, assist source and species risk assessments for industry, and provide support for policy implementation and targeted enforcement efforts to government agencies.",2026-06-17T04:18:18.409730+00:00
2606.18175v1,A Convex Quasilinearization Method for Solving Nonlinear PDEs with Physics-Informed Neural Networks,Gbenga T. Awojinrin; Abdul-Akeem Olawoyin; Rami M. Younis,math.NA; cs.LG; physics.comp-ph,2026-06-16T17:09:59+00:00,2026-06-16T17:09:59+00:00,http://arxiv.org/abs/2606.18175v1,https://arxiv.org/pdf/2606.18175v1,,,"We present a numerical method for the forward solution of nonlinear partial differential equations (PDEs) in which Bellman-Kalaba quasilinearization reduces the nonlinear problem to a sequence of linear subproblems, each discretized by collocation onto a trial space that is linear in its parameters and solved by a single direct linear least-squares QR factorization. The trial space, which we term Linear-in-Learnables (LiL), comprises representations whose trainable parameters enter linearly, including random-feature extreme learning machines, spectral polynomial bases, and trigonometric expansions, each implemented as a physics-informed neural network. The method thus replaces the nonconvex gradient-based training that limits standard PINNs with a convex per-step solve. We establish local Newton-Kantorovich convergence of the outer iteration to a residual-limited neighborhood under an explicit smallness condition, with the limiting accuracy governed by the best-approximation residual of the trial space rather than by an optimization tolerance. The method, denoted LiL-Q, is assessed on seven benchmarks spanning scalar nonlinear PDEs (Bratu, viscous Burgers, Buckley-Leverett), coupled systems (plane-strain elasticity and the incompressible Navier-Stokes equations in two and three spatial dimensions), and steady-state Darcy flow with heterogeneous permeability. Across these problems, LiL-Q converges in single-digit outer iterations in most cases, even at the coarsest basis sizes and independent of the parameter count. When the exact solution lies in the span of the trial space, the method recovers it to machine precision in a single solve. On the Navier-Stokes benchmarks, it matches or exceeds published PINN solvers with up to two orders of magnitude fewer trainable parameters, without gradient-based optimization.",2026-06-17T04:18:18.409735+00:00
2606.18166v1,Evaluating Open-Source LLMs for Multi-Label ATT&CK Technique Classification on CTI Reports,Ahmed Ryan; Saad Sakib Noor; Md Erfan; Shaswata Mitra; Sudip Mittal; Md Rayhanur Rahman,cs.CR; cs.LG,2026-06-16T17:04:15+00:00,2026-06-16T17:04:15+00:00,http://arxiv.org/abs/2606.18166v1,https://arxiv.org/pdf/2606.18166v1,,,"Classifying Cyber Threat Intelligence (CTI) using MITRE Adversarial Tactics, Techniques, and Common Knowledge (ATT&CK) is essential for proactive defense, but historically required extensive human effort. Pre-Large Language Model (LLM) automation sped up this process, but could not resolve the complex language and multi-step attack patterns found in unstructured CTI reports. LLMs addressed previous limitations by using contextual reasoning to understand unstructured text. However, current evaluations rely on simplified, single-technique sentences that ignore the complexity of real-world CTI reports, which often leads to inflated performance results. Consequently, the baseline performance of open-source LLMs on complex unstructured CTI reports remains unevaluated. To address this gap, we constructed a ground-truth dataset of 2,076 human-annotated sentences (1,281 technique-positive, 795 negative) from 83 complex unstructured CTI reports. These sentences were mapped to 114 unique ATT&CK techniques using a six-phase annotation process, achieving \k{appa} = 0.68 inter-annotator agreement. Using this dataset, we evaluated seven open-source LLMs ranging from 8B to 236B parameters across prompt strategy and temperature configurations. The highest-performing LLM achieved a micro-averaged F1 score of 0.22, establishing the empirical baseline for multi-label ATT&CK classification on complex unstructured CTI. Parameter size showed a statistically significant positive correlation with F1 score. Prompt strategy and temperature produced no statistically significant gains across model configurations. These results indicate that current open-source LLMs are insufficient for production-grade ATT&CK classification. The dataset, benchmark, and findings provide a reproducible foundation for future CTI research.",2026-06-17T04:18:18.409740+00:00
2606.18158v1,The Measurement Gap in the Automation of EU Law: Benchmarking Doctrinal Legal Reasoning under the EU AI Act,Michèle Finck,cs.CY; cs.AI; cs.CL,2026-06-16T16:57:12+00:00,2026-06-16T16:57:12+00:00,http://arxiv.org/abs/2606.18158v1,https://arxiv.org/pdf/2606.18158v1,,,"Large language models now produce legal text of at least median quality, yet no existing benchmark can evaluate whether they perform doctrinal legal reasoning, which forms the interpretive core of legal work, rather than the ancillary, paralegal tasks that most current legal-AI evaluations measure. This measurement gap is not only methodological but legal: the EU AI Act makes ""appropriate accuracy"" a binding requirement for high-risk AI used in the judicial domain, yet that requirement cannot acquire operational content without the very doctrinal-reasoning benchmark the field lacks.",2026-06-17T04:18:18.409747+00:00
2606.18156v1,ReAge3D: Re-Aging 3D Faces with View Consistency,Libing Zeng; Li Ma; Mingming He; Ning Yu; Paul Debevec; Nima Khademi Kalantari,cs.CV; cs.AI,2026-06-16T16:56:00+00:00,2026-06-16T16:56:00+00:00,http://arxiv.org/abs/2606.18156v1,https://arxiv.org/pdf/2606.18156v1,,,"We present a novel framework for realistic and controllable 3D face re-aging which produces highly detailed, identity-preserving results. Existing 3D editing methods, while effective for coarse semantic changes, are not well suited for re-aging, as even small inconsistencies across re-aged 2D views can lead to over-smoothing of subtle but perceptually important age-related details. To address this challenge, we first introduce a 2D diffusion-based re-aging model, DiffReaging, trained on synthetically generated image pairs. We further propose a center-out editing propagation strategy that leverages this re-aging model to reconstruct multi-view-consistent re-aged images. Specifically, starting from a re-aged frontal pivot view, we reconstruct the remaining views through warping and our proposed Masked-DiffReaging process. By injecting existing content at every step of the diffusion process, Masked-DiffReaging ensures that the reconstructed regions remain coherent with existing pixels. The resulting consistent set of re-aged views supervises the optimization of the re-aged 3D representation. Our method outperforms existing 3D editing techniques both visually and quantitatively, enabling smooth, fine-grained control over age transformations in 3D face models.",2026-06-17T04:18:18.409752+00:00
2606.18154v1,Learning Cardiac Electrophysiology Digital Twins Through Agentic Discovery of Hybrid Structure,Ziqi Zhou; Yubo Ye; Sumeet Atul Vadhavka; Linwei Wang; Zhiqiang Tao,cs.AI,2026-06-16T16:54:03+00:00,2026-06-16T16:54:03+00:00,http://arxiv.org/abs/2606.18154v1,https://arxiv.org/pdf/2606.18154v1,,,"Building personalized cardiac electrophysiology (EP) digital twins requires identifying the appropriate model structure for each patient, not merely fitting parameters. Traditional methods rely on experts to manually prescribe hybrid physics-neural architectures, which requires deep domain expertise and does not transfer across patients. Recent works have applied large language models (LLMs) to generate or act as hybrid models. However, despite their promising generalization capacity, these LLM-based methods lack the structural priors needed for stable cardiac simulations. Hence, we propose LEADS, a framework that formulates cardiac EP domain knowledge as a structured action space and utilizes an LLM agent to discover hybrid models. The agent follows an iterative reasoning-and-action loop to select, combine, and refine hybrid models, whilst gradient descent handles parameter fitting. The proposed LEADS designs every candidate model towards physically grounded, interpretable, and numerically stable, while allowing open-ended architectural discovery. We validate LEADS on synthetic data with three ground-truth reaction models and on real cardiac EP data, demonstrating that it outperforms both human-designed hybrid models and other LLM-based hybrid modeling.",2026-06-17T04:18:18.409759+00:00
2606.18144v1,"Memory as a Wasting Asset: Pricing Flash Endurance for Embodied Agents, and the Limits of Doing So",Josef Liyanjun Chen,cs.AI; cs.CY; cs.LG; cs.RO,2026-06-16T16:43:19+00:00,2026-06-16T16:43:19+00:00,http://arxiv.org/abs/2606.18144v1,https://arxiv.org/pdf/2606.18144v1,,,"A robot's flash endurance is a non-renewable stock: every persisted write spends one of a few thousand program/erase cycles and never refills, yet no fielded robot memory system prices which memories are worth an erase cycle. We treat embodied memory as depreciating capital and price that stock with a single endurance shadow price $η$, which makes cost-minimizing placement across a RAM / on-board NVM / cloud hierarchy a threshold in a wear-augmented per-byte index. The index is cost-optimal whatever the sign of the value-write association $χ$; only when $χ> 0$ does the optimum turn non-monotone, sending a robot's most valuable memories off its flash.   The pivot is thus empirical, and we measure $χ$ on real robot logs at a pre-specified gate: its sign is a property of the deployment regime -- positive on recurrent long-horizon manipulation ($\hatχ \approx +1.0 \times 10^{-3}$, replicated at full power), null on a shorter-horizon suite, and negative on non-recurrent teleoperation. Two boundaries scope the result. The endurance budget is dormant on premium 3,000-P/E TLC at datasheet prices and binding on the commodity QLC/eMMC ($\sim$1,000 P/E) that cheaper edge robots run. And where it binds, a learned wear-aware controller only ties price-based routing on task value, because realized value is tier-invariant across RAM, NVM, and cloud: the rent governs device lifetime and cost, not task performance. Whether wear-aware placement improves task value remains open -- $χ$ is measured against a value proxy, and the non-monotone optimum, while proven, is not yet observed in data.",2026-06-17T04:18:18.409765+00:00
2606.18124v1,Unintended Effects of Geographic Conditioning in Large Language Models,Naz Col; David M. Chan,cs.CL,2026-06-16T16:23:36+00:00,2026-06-16T16:23:36+00:00,http://arxiv.org/abs/2606.18124v1,https://arxiv.org/pdf/2606.18124v1,,,"Modern conversational AI systems frequently rely on user metadata to localize responses, yet the unintended regional biases introduced by this hidden context remain poorly understood. In this work, we evaluate location leakage: the phenomenon where a model generates geographic references despite receiving a geographically neutral user prompt. Across both creative writing and open-ended Q&A prompts, even state-of-the-art LLMs systematically favor region-specific outputs when exposed to location metadata, with leakage spiking by up to 793 times above baseline (e.g., from 0.04% to 31.7% for Llama 3.1-8B, and 21.3% and 8.8% for Qwen3-8B and Claude Sonnet 4.6, respectively). Our analysis further shows a novel structural conditioning effect: replacing the injected location with the placeholder ""Unknown"" still elevates leakage by up to 72 times above baseline, demonstrating that the user profile frame itself, independent of any geographic content, acts as a generative conditioning signal.",2026-06-17T04:18:18.409771+00:00
2606.18122v1,"Embedded Machine Learning for Microcontroller-Class Edge Devices: Data, Feature, Evaluation, and Deployment Pipelines",Mostafa Darvishi,cs.LG; cs.AI; cs.AR; eess.AS; eess.SP,2026-06-16T16:22:24+00:00,2026-06-16T16:22:24+00:00,http://arxiv.org/abs/2606.18122v1,https://arxiv.org/pdf/2606.18122v1,,,"Embedded machine learning moves inference from cloud services to resource-constrained devices that must acquire data, preprocess signals, run a model, and act within tight limits on memory, energy, and latency. This paper presents a systems-oriented synthesis of an embedded machine-learning workflow for microcontroller-class platforms. The emphasis is placed on engineering decisions that are often hidden in generic machine-learning introductions: sampling and buffering, feature extraction as dimensionality reduction, validation under class imbalance, model/runtime co-design, and streaming deployment. Two representative signal families are used throughout the paper. The first is inertial motion recognition, where a two-second, three-axis accelerometer window is transformed from raw samples into root-mean-square and spectral features before classification. The second is keyword spotting, where audio is sampled, anti-aliased, transformed into mel-frequency cepstral coefficients, and processed by a compact one-dimensional convolutional network. The paper concludes with practical design rules for robust on-device inference, including data curation, quantization, thresholding, scheduling, and field monitoring.",2026-06-17T04:18:18.409776+00:00
2606.18120v1,"Structural Role Injection in Handlebars-Templated LLM Prompts: Triple-Brace Interpolation, Delimiter Family, and the Limits of HTML Auto-Escaping",Mohammadreza Rashidi,cs.CR; cs.AI; cs.CL; cs.LG,2026-06-16T16:21:43+00:00,2026-06-16T16:21:43+00:00,http://arxiv.org/abs/2606.18120v1,https://arxiv.org/pdf/2606.18120v1,,,"Large language model applications build prompts from templates, and Handlebars is a widely used templating engine and the default prompt-template format in Microsoft Semantic Kernel. Its double-brace {x} expression HTML-escapes the interpolated value and is documented as the safe default; its triple-brace {x} expression inserts the value raw. We show that this choice silently governs an application's exposure to structural role injection, where attacker-controlled data carries chat role delimiters that forge a higher-privilege turn. A model-free analysis establishes the mechanism: Handlebars escaping rewrites angle brackets but not square brackets, colons, or Markdown hashes, so it neutralises ChatML, Llama-3, and XML role delimiters (survival rate 0.00) while leaving Llama-2 [INST], legacy Human:/Assistant:, and Markdown ### delimiters intact (survival rate 1.00 for the last two). We then run 5760 trials across seven delimiter families, two attack objectives, and four models (GPT-3.5 Turbo, GPT-4o mini, GPT-4.1 mini, Claude Haiku 4.5) at a combined API cost of 1.63 USD. GPT-3.5 Turbo follows the task-hijack instruction in 97% of raw and 91% of escaped trials, with the escaping protection concentrated in the angle-bracket families and absent for the colon- and Markdown-based families; the harder secret-exfiltration objective, which does not saturate, exposes the same family interaction more cleanly. Claude Haiku 4.5 resists both objectives almost entirely. The escaped default protects only the delimiter schemes whose characters HTML escaping happens to cover, gives no protection for the rest, and cannot substitute for a structural separation of instruction and data.",2026-06-17T04:18:18.409780+00:00
2606.18114v1,Ternary Mamba: Grouped Quantization-Aware Training of W1.58A16 State Space Models,Ramprasath Ganesaraja; Sahil Dilip Panse; Swathika N,cs.LG; cs.AI,2026-06-16T16:18:21+00:00,2026-06-16T16:18:21+00:00,http://arxiv.org/abs/2606.18114v1,https://arxiv.org/pdf/2606.18114v1,,,"State Space Models (SSMs) such as Mamba-2 offer linear-time inference but their memory footprint limits edge deployment. Prior ternary SSM work (Slender-Mamba) trains from scratch on 150B tokens; we show a pretrained checkpoint suffices, reducing the marginal token budget by 1,000x. Using grouped quantization-aware training (QAT) with knowledge distillation from a frozen FP16 teacher, we compress Mamba-2 1.3B to 3.61x (2,687 to 744 MB) and achieve 48.1% zero-shot accuracy (7-task average) in just 102M tokens (4 GPU-hours, single H100) -- approaching Bi-Mamba's 48.4% (within +/-0.9pp CI). This QAT-from-pretrained setting reveals zero-ratio collapse, a novel instability caused by learnable quantization scales that does not arise in from-scratch training. We further show that post-hoc correction strategies effective for Transformers fail for SSMs due to error accumulation through the recurrence. These results demonstrate that ternary SSMs do not require expensive from-scratch training: QAT from pretrained checkpoints with KD is a data-efficient alternative.",2026-06-17T04:18:18.409785+00:00
2606.18111v1,Learning Fair Pareto-Optimal Policies in Multi-Objective Reinforcement Learning,Umer Siddique; Peilang Li; Yongcan Cao,cs.LG; cs.AI,2026-06-16T16:16:54+00:00,2026-06-16T16:16:54+00:00,http://arxiv.org/abs/2606.18111v1,https://arxiv.org/pdf/2606.18111v1,,,"Fairness is an important aspect of decision-making in multi-objective reinforcement learning (MORL), where policies must ensure both optimality and equity across multiple, potentially conflicting objectives. While single-policy MORL methods can learn fair policies for fixed user preferences using welfare functions such as the generalized Gini welfare function (GGF), they fail to provide the diverse set of policies necessary for dynamic or unknown user preferences. To address this limitation, we formalize the fair optimization problem in multi-policy MORL, where the goal is to learn a set of Pareto-optimal policies that ensure fairness across all possible user preferences. Our key technical contributions are threefold: (1) We show that for concave, piecewise-linear welfare functions (e.g., GGF), fair policies remain in the convex coverage set (CCS), which is an approximated Pareto front for linear scalarization. (2) We demonstrate that non-stationary policies, augmented with accrued reward histories, and stochastic policies improve fairness by dynamically adapting to historical inequities. (3) We propose three novel algorithms, which include integrating GGF with multi-policy multi-objective Q-Learning (MOQL), state-augmented multi-policy MOQL for learning non-statoinary policies, and its novel extension for learning stochastic policies. We evaluate our algorithms across various domains and compare our methods against the state-of-the-art MORL baselines. The empirical results show that our methods learn a set of fair policies that accommodate different user preferences.",2026-06-17T04:18:18.409789+00:00
2606.18108v1,Querying an astronomical database using large language models: the ALeRCE text-to-SQL system,P. A. Estevez; J. Espejo-Moreira; S. Sanfeliu-Alvarez; F. Forster; A. M. Munoz Arancibia; G. Cabrera-Vives; F. E. Bauer; A. Bayo; M. Catelan; R. Dastidar; L. Hernandez-Garcia; J. A. Intriago; G. Pignata,astro-ph.IM; cs.AI,2026-06-16T16:12:16+00:00,2026-06-16T16:12:16+00:00,http://arxiv.org/abs/2606.18108v1,https://arxiv.org/pdf/2606.18108v1,,,"We develop a text-to-SQL (structured query language) system based on large language models (LLMs) using in-context learning and apply it to the Automatic Learning for the Rapid Classification of Events (ALeRCE) astronomical database. ALeRCE is a community broker for the Zwicky Transient Facility and the Vera C. Rubin Observatory. The system enables users to query the database in natural language (NL) and generates executable SQL queries. To develop and evaluate the system, we constructed a dataset of 110 NL/SQL pairs. We propose a step-by-step generation framework comprising four modules: schema linking, query classification, prompt decomposition, and self-correction. The performance of thirteen LLMs is evaluated using in-context learning and prompt engineering techniques. Text-to-SQL performance is assessed using the perfect-match (PM) rate for row identifiers (e.g., object identifiers) and column identifiers (i.e., column names). The proposed step-by-step framework consistently outperforms a direct-inference baseline, while the self-correction module consistently reduces execution errors. For Claude Opus 4.6, PM performance on row (column) identifiers is high for simple queries, reaching 0.97 (0.94), and decreases with query complexity to 0.44 (0.72) for medium queries and 0.59 (0.49) for hard queries. Among the thirteen evaluated models, the best-performing LLMs for the text-to-SQL task are Claude Opus 4.6, Gemini 2.5 Pro, Gemini 3 Flash, and GPT-5.2-Codex.",2026-06-17T04:18:18.409794+00:00
