arxiv_id,title,authors,categories,published,updated,url,pdf_url,doi,journal_ref,abstract,collected_at
2604.17857v1,On the Emergence of Syntax by Means of Local Interaction,Zichao Wei,cs.CL; cs.AI; cs.LG,2026-04-20T06:10:50+00:00,2026-04-20T06:10:50+00:00,http://arxiv.org/abs/2604.17857v1,https://arxiv.org/pdf/2604.17857v1,,,"Can syntactic processing emerge spontaneously from purely local interaction? We present a concrete instance on a minimal system: an 18,658-parameter two-dimensional neural cellular automaton (NCA), supervised by nothing more than a 1-bit boundary signal, is trained on the membership problem of an arithmetic-expression grammar. After training, its internal $L \times L$ grid spontaneously self-organizes into an ordered, spatially extended representation that we name Proto-CKY. This representation satisfies three operational criteria for syntactic processing: expressive power beyond the regular languages, structural generalization beyond the training distribution, and an internal organization quantitatively aligned with grammatical structure (Pearson $r \approx 0.71$). It emerges independently on four context-free grammars and regenerates spontaneously after perturbation. Proto-CKY is functionally aligned with the CKY algorithm but formally distinct from it: it is a physical prototype, a concrete instantiation of a mathematical ideal on a physical substrate, and the systematic distance between the two carries information about the substrate itself.",2026-04-21T02:47:08.087606+00:00
2604.17838v1,Efficient Diffusion Models under Nonconvex Equality and Inequality constraints via Landing,Kijung Jeon; Michael Muehlebach; Molei Tao,cs.LG; stat.CO; stat.ML,2026-04-20T05:47:27+00:00,2026-04-20T05:47:27+00:00,http://arxiv.org/abs/2604.17838v1,https://arxiv.org/pdf/2604.17838v1,,,"Generative modeling within constrained sets is essential for scientific and engineering applications involving physical, geometric, or safety requirements (e.g., molecular generation, robotics). We present a unified framework for constrained diffusion models on generic nonconvex feasible sets $Σ$ that simultaneously enforces equality and inequality constraints throughout the diffusion process. Our framework incorporates both overdamped and underdamped dynamics for forward and backward sampling. A key algorithmic innovation is a computationally efficient landing mechanism that replaces costly and often ill-defined projections onto $Σ$, ensuring feasibility without iterative Newton solves or projection failures. By leveraging underdamped dynamics, we accelerate mixing toward the prior distribution, effectively alleviating the high simulation costs typically associated with constrained diffusion. Empirically, this approach reduces function evaluations and memory usage during both training and inference while preserving sample quality. On benchmarks featuring equality and mixed constraints, our method achieves comparable sample quality to state-of-the-art baselines while significantly reducing computational cost, providing a practical and scalable solution for diffusion on nonconvex feasible sets.",2026-04-21T02:47:08.087669+00:00
2604.17837v1,"Polysemantic Experts, Monosemantic Paths: Routing as Control in MoEs",Charles Ye; Bo Yuan; Lee Sharkey,cs.AI; cs.CL; cs.LG,2026-04-20T05:47:26+00:00,2026-04-20T05:47:26+00:00,http://arxiv.org/abs/2604.17837v1,https://arxiv.org/pdf/2604.17837v1,,,"An LLM's residual stream is both state and instruction: it encodes the current context and determines the next transformation. We introduce a parameter-free decomposition for Mixture-of-Experts models that splits each layer's hidden state into a control signal that causally drives routing and an orthogonal content channel invisible to the router. Across six MoE architectures, we find that models preserve surface-level features (language, token identity, position) in the content channel, while the control signal encodes an abstract function that rotates from layer to layer. Because each routing decision is low-bandwidth, this hand-off forces compositional specialization across layers. While individual experts remain polysemantic, expert paths become monosemantic, clustering tokens by semantic function across languages and surface forms. The same token (e.g., "":"") follows distinct trajectories depending on whether it serves as a type annotation, an introductory colon, or a time separator. Our decomposition identifies the source of this structure: clusters in the control subspace are substantially more monosemantic than those in the full representation. As a result, the natural unit of interpretability in MoEs is not the expert but the trajectory.",2026-04-21T02:47:08.087714+00:00
2604.17827v1,Learning to Seek Help: Dynamic Collaboration Between Small and Large Language Models,Hang Zeng; Xiangyu Liu; Yong Hu; Chaoyue Niu; Jiarui Zhang; Shaojie Tang; Fan Wu; Guihai Chen,cs.CL,2026-04-20T05:28:26+00:00,2026-04-20T05:28:26+00:00,http://arxiv.org/abs/2604.17827v1,https://arxiv.org/pdf/2604.17827v1,,,"Large language models (LLMs) offer strong capabilities but raise cost and privacy concerns, whereas small language models (SLMs) facilitate efficient and private local inference yet suffer from limited capacity. To synergize the complementary strengths, we introduce a dynamic collaboration framework, where an SLM learns to proactively decide how to request an LLM during multi-step reasoning, while the LLM provides adaptive feedback instead of acting as a passive tool. We further systematically investigate how collaboration strategies are shaped by SLM and LLM capabilities as well as efficiency and privacy constraints. Evaluation results reveal a distinct scaling effect: stronger SLMs become more self-reliant, while stronger LLMs enable fewer and more informative interactions. In addition, the learned dynamic collaboration strategies significantly outperform static pipelines and standalone inference, and transfer robustly to unseen LLMs.",2026-04-21T02:47:08.087760+00:00
2604.17823v1,A novel LSTM music generator based on the fractional time-frequency feature extraction,Li Ya; Chen Wei; Li Xiulai; Yu Lei; Deng Xinyi; Chen Chaofan,cs.SD; cs.AI; cs.CL,2026-04-20T05:22:56+00:00,2026-04-20T05:22:56+00:00,http://arxiv.org/abs/2604.17823v1,https://arxiv.org/pdf/2604.17823v1,,,"In this paper, we propose a novel approach for generating music based on an artificial intelligence (AI) system. We analyze the features of music and use them to fit and predict the music. The fractional Fourier transform (FrFT) and the long short-term memory (LSTM) network are the foundations of our method. The FrFT method is used to extract the spectral features of a music piece, where the music signal is expressed on the time and frequency domains. The LSTM network is used to generate new music based on the extracted features, where we predict the music according to the hidden layer features and real-time inputs using GiantMIDI-Piano dataset. The results of our experiments show that our proposed system is capable of generating high-quality music that is comparable to human-generated music.",2026-04-21T02:47:08.087804+00:00
