arxiv_id,title,authors,categories,published,updated,url,pdf_url,doi,journal_ref,abstract,collected_at
2604.18003v1,SELF-EMO: Emotional Self-Evolution from Recognition to Consistent Expression,Shaowei Zhang; Faqiang Qian; Yan Chen; Ziliang Wang; Kang An; Yong Dai; Mengya Gao; Yichao Wu,cs.AI,2026-04-20T09:27:40+00:00,2026-04-20T09:27:40+00:00,http://arxiv.org/abs/2604.18003v1,https://arxiv.org/pdf/2604.18003v1,,,"Emotion Recognition in Conversation (ERC) has become a fundamental capability for large language models (LLMs) in human-centric interaction. Beyond accurate recognition, coherent emotional expression is also crucial, yet both are limited by the scarcity and static nature of high-quality annotated data. In this work, we propose SELF-EMO, a self-evolution framework grounded in the hypothesis that better emotion prediction leads to more consistent emotional responses. We introduce two auxiliary tasks, emotional understanding and emotional expression, and design a role-based self-play paradigm where the model acts as both an emotion recognizer and a dialogue responder. Through iterative interactions, the model generates diverse conversational trajectories, enabling scalable data generation. To ensure quality, we adopt a data flywheel mechanism that filters candidate predictions and responses using a smoothed IoU-based reward and feeds selected samples back for continuous self-improvement without external supervision. We further develop SELF-GRPO, a reinforcement learning algorithm that stabilizes optimization with multi-label alignment rewards and group-level consistency signals. Experiments on IEMOCAP, MELD, and EmoryNLP show that SELF-EMO achieves state-of-the-art performance, improving accuracy by +6.33% on Qwen3-4B and +8.54% on Qwen3-8B, demonstrating strong effectiveness and generalization.",2026-04-21T02:47:08.086297+00:00
2604.18002v1,Neural Garbage Collection: Learning to Forget while Learning to Reason,Michael Y. Li; Jubayer Ibn Hamid; Emily B. Fox; Noah D. Goodman,cs.LG,2026-04-20T09:26:28+00:00,2026-04-20T09:26:28+00:00,http://arxiv.org/abs/2604.18002v1,https://arxiv.org/pdf/2604.18002v1,,,"Chain-of-thought reasoning has driven striking advances in language model capability, yet every reasoning step grows the KV cache, creating a bottleneck to scaling this paradigm further. Current approaches manage these constraints on the model's behalf using hand-designed criteria. A more scalable approach would let end-to-end learning subsume this design choice entirely, following a broader pattern in deep learning. After all, if a model can learn to reason, why can't it learn to forget? We introduce Neural Garbage Collection (NGC), in which a language model learns to forget while learning to reason, trained end-to-end from outcome-based task reward alone. As the model reasons, it periodically pauses, decides which KV cache entries to evict, and continues to reason conditioned on the remaining cache. By treating tokens in a chain-of-thought and cache-eviction decisions as discrete actions sampled from the language model, we can use reinforcement learning to jointly optimize how the model reasons and how it manages its own memory: what the model evicts shapes what it remembers, what it remembers shapes its reasoning, and the correctness of that reasoning determines its reward. Crucially, the model learns this behavior entirely from a single learning signal - the outcome-based task reward - without supervised fine-tuning or proxy objectives. On Countdown, AMC, and AIME tasks, NGC maintains strong accuracy relative to the full-cache upper bound at 2-3x peak KV cache size compression and substantially outperforms eviction baselines. Our results are a first step towards a broader vision where end-to-end optimization drives both capability and efficiency in language models.",2026-04-21T02:47:08.086338+00:00
2604.17998v1,Causally-Constrained Probabilistic Forecasting for Time-Series Anomaly Detection,Pooyan Khosravinia; João Gama; Bruno Veloso,cs.LG,2026-04-20T09:24:28+00:00,2026-04-20T09:24:28+00:00,http://arxiv.org/abs/2604.17998v1,https://arxiv.org/pdf/2604.17998v1,,,"Anomaly detection in multivariate time series is a central challenge in industrial monitoring, as failures frequently arise from complex temporal dynamics and cross-sensor interactions. While recent deep learning models, including graph neural networks and Transformers, have demonstrated strong empirical performance, most approaches remain primarily correlational and offer limited support for causal interpretation and root-cause localization. This study introduces a causally-constrained probabilistic forecasting framework which is a Causally Guided Transformer (CGT) model for multivariate time-series anomaly detection, integrating an explicit time-lagged causal graph prior with deep sequence modeling. For each target variable, a dedicated forecasting block employs a hard parent mask derived from causal discovery to restrict the main prediction pathway to graph-supported causes, while a latent Gaussian head captures predictive uncertainty. To leverage residual correlational information without compromising the causal representation, a shadow auxiliary path with stop-gradient isolation and a safety-gated blending mechanism is incorporated to suppress non-causal contributions when reliability is low. Anomalies are identified using negative log-likelihood scores with adaptive streaming thresholding, and root-cause variables are determined through per-dimension probabilistic attribution and counterfactual clamping. Experiments on the ASD and SMD benchmarks indicate that the proposed method achieves state-of-the-art detection performance, with F1-scores of 96.19% on ASD and 95.32% on SMD, and enhances variable-level attribution quality. These findings suggest that causal structural priors can improve both robustness and interpretability in detecting deep anomalies in multivariate sensor systems.",2026-04-21T02:47:08.086381+00:00
2604.17988v1,Employing General-Purpose and Biomedical Large Language Models with Advanced Prompt Engineering for Pharmacoepidemiologic Study Design,Xinyao Zhang; Nicole Sonne Heckmann; Manuela Del Castillo Suero; Francesco Paolo Speca; Maurizio Sessa,cs.CL,2026-04-20T09:10:30+00:00,2026-04-20T09:10:30+00:00,http://arxiv.org/abs/2604.17988v1,https://arxiv.org/pdf/2604.17988v1,,,"Background: The potential of large language models (LLMs) to automate and support pharmacoepidemiologic study design is an emerging area of interest, yet their reliability remains insufficiently characterized. General-purpose LLMs often display inaccuracies, while the comparative performance of specialized biomedical LLMs in this domain remains unknown. Methods: This study evaluated general-purpose LLMs (GPT-4o and DeepSeek-R1) versus biomedically fine-tuned LLMs (QuantFactory/Bio-Medical-Llama-3-8B-GGUF and Irathernotsay/qwen2-1.5B-medical_qa-Finetune) using 46 protocols (2018-2024) from the HMA-EMA Catalogue and Sentinel System. Performance was assessed across relevance, logic of justification, and ontology-code agreement across multiple coding systems using Least-to-Most (LTM) and Active Prompting strategies. Results: GPT-4o and DeepSeek-R1 paired with LTM prompting achieved the highest relevance and logic of justification scores, with GPT-4o-LTM reaching a median relevance score of 4 in 8 of 9 questions for HMA-EMA protocols. Biomedical LLMs showed lower relevance overall and frequently generated insufficient justification. All LLMs demonstrated limited proficiency in ontology-code mapping, although LTM provided the most consistent improvements in reasoning stability. Conclusion: Off-the-shelf general-purpose LLMs currently offer superior support for pharmacoepidemiologic design compared to biomedical LLMs. Prompt strategy strongly influenced LLM performance.",2026-04-21T02:47:08.086425+00:00
2604.17986v1,Latent Fourier Transform,Mason Wang; Cheng-Zhi Anna Huang,cs.SD; cs.AI,2026-04-20T09:08:13+00:00,2026-04-20T09:08:13+00:00,http://arxiv.org/abs/2604.17986v1,https://arxiv.org/pdf/2604.17986v1,,,"We introduce the Latent Fourier Transform (LatentFT), a framework that provides novel frequency-domain controls for generative music models. LatentFT combines a diffusion autoencoder with a latent-space Fourier transform to separate musical patterns by timescale. By masking latents in the frequency domain during training, our method yields representations that can be manipulated coherently at inference. This allows us to generate musical variations and blends from reference examples while preserving characteristics at desired timescales, which are specified as frequencies in the latent space. LatentFT parallels the role of the equalizer in music production: while traditional equalizers operates on audible frequencies to shape timbre, LatentFT operates on latent-space frequencies to shape musical structure. Experiments and listening tests show that LatentFT improves condition adherence and quality compared to baselines. We also present a technique for hearing frequencies in the latent space in isolation, and show different musical attributes reside in different regions of the latent spectrum. Our results show how frequency-domain control in latent space provides an intuitive, continuous frequency axis for conditioning and blending, advancing us toward more interpretable and interactive generative music models.",2026-04-21T02:47:08.086462+00:00
2604.17984v1,Online Conformal Prediction with Adversarial Semi-bandit Feedback via Regret Minimization,Junyoung Yang; Kyungmin Kim; Sangdon Park,cs.LG; stat.ML,2026-04-20T09:07:40+00:00,2026-04-20T09:07:40+00:00,http://arxiv.org/abs/2604.17984v1,https://arxiv.org/pdf/2604.17984v1,,,"Uncertainty quantification is crucial in safety-critical systems, where decisions must be made under uncertainty. In particular, we consider the problem of online uncertainty quantification, where data points arrive sequentially. Online conformal prediction is a principled online uncertainty quantification method that dynamically constructs a prediction set at each time step. While existing methods for online conformal prediction provide long-run coverage guarantees without any distributional assumptions, they typically assume a full feedback setting in which the true label is always observed. In this paper, we propose a novel learning method for online conformal prediction with partial feedback from an adaptive adversary-a more challenging setup where the true label is revealed only when it lies inside the constructed prediction set. Specifically, we formulate online conformal prediction as an adversarial bandit problem by treating each candidate prediction set as an arm. Building on an existing algorithm for adversarial bandits, our method achieves a long-run coverage guarantee by explicitly establishing its connection to the regret of the learner. Finally, we empirically demonstrate the effectiveness of our method in both independent and identically distributed (i.i.d.) and non-i.i.d. settings, showing that it successfully controls the miscoverage rate while maintaining a reasonable size of the prediction set.",2026-04-21T02:47:08.086501+00:00
2604.17968v1,From Fallback to Frontline: When Can LLMs be Superior Annotators of Human Perspectives?,Hasan Amin; Harry Yizhou Tian; Xiaoni Duan; Chien-Ju Ho; Rajiv Khanna; Ming Yin,cs.AI; cs.CL,2026-04-20T08:48:38+00:00,2026-04-20T08:48:38+00:00,http://arxiv.org/abs/2604.17968v1,https://arxiv.org/pdf/2604.17968v1,,,"Although large language models (LLMs) are increasingly used as annotators at scale, they are typically treated as a pragmatic fallback rather than a faithful estimator of human perspectives. This work challenges that presumption. By framing perspective-taking as the estimation of a latent group-level judgment, we characterize the conditions under which modern LLMs can outperform human annotators, including in-group humans, when predicting aggregate subgroup opinions on subjective tasks, and show that these conditions are common in practice. This advantage arises from structural properties of LLMs as estimators, including low variance and reduced coupling between representation and processing biases, rather than any claim of lived experience. Our analysis identifies clear regimes where LLMs act as statistically superior frontline estimators, as well as principled limits where human judgment remains essential. These findings reposition LLMs from a cost-saving compromise to a principled tool for estimating collective human perspectives.",2026-04-21T02:47:08.086544+00:00
2604.17967v1,A Sugeno Integral View of Binarized Neural Network Inference,Ismaïl Baaj; Henri Prade,cs.AI; cs.LG,2026-04-20T08:47:06+00:00,2026-04-20T08:47:06+00:00,http://arxiv.org/abs/2604.17967v1,https://arxiv.org/pdf/2604.17967v1,,,"In this article, we establish a precise connection between binarized neural networks (BNNs) and Sugeno integrals. The advantage of the Sugeno integral is that it provides a framework for representing the importance of inputs and their interactions, while being equivalent to a set of if-then rules. For a hidden BNN neuron at inference time, we show that the activation threshold test can be written as a Sugeno integral on binary inputs. This yields an explicit set-function representation of each neuron decision, and an associated rule-based representation. We also provide a Sugeno-integral expression for the last-layer score. Finally, we discuss how the same framework can be adapted to support richer input interactions and how it can be extended beyond the binary case induced by binarized neural networks.",2026-04-21T02:47:08.086581+00:00
2604.17960v1,The Umwelt Representation Hypothesis: Rethinking Universality,Victoria Bosch; Rowan Sommers; Adrien Doerig; Tim C Kietzmann,q-bio.NC; cs.LG,2026-04-20T08:40:55+00:00,2026-04-20T08:40:55+00:00,http://arxiv.org/abs/2604.17960v1,https://arxiv.org/pdf/2604.17960v1,,,"Recent studies reveal striking representational alignment between artificial neural networks (ANNs) and biological brains, leading to proposals that all sufficiently capable systems converge on universal representations of reality. Here, we argue that this claim of Universality is premature. We introduce the Umwelt Representation Hypothesis (URH), proposing that alignment arises not from convergence toward a single global optimum, but from overlap in ecological constraints under which systems develop. We review empirical evidence showing that representational differences between species, individuals, and ANNs are systematic and adaptive, which is difficult to reconcile with Universality. Finally, we reframe ANN model comparison as a method for mapping clusters of alignment in ecological constraint space rather than searching for a single optimal world model.",2026-04-21T02:47:08.086619+00:00
2604.17957v1,Process Reward Models Meet Planning: Generating Precise and Scalable Datasets for Step-Level Rewards,Raffaele Pisano; Roberto Navigli,cs.CL,2026-04-20T08:39:13+00:00,2026-04-20T08:39:13+00:00,http://arxiv.org/abs/2604.17957v1,https://arxiv.org/pdf/2604.17957v1,,,"Process Reward Models (PRMs) have emerged as a powerful tool for providing step-level feedback when evaluating the reasoning of Large Language Models (LLMs), which frequently produce chains of thought (CoTs) containing errors even when the final answer is correct. However, existing PRM datasets remain expensive to construct, prone to annotation errors, and predominantly limited to the mathematical domain. This work introduces a novel and scalable approach to PRM dataset generation based on planning logical problems expressed in the Planning Domain Definition Language (PDDL). Using this method, we generate a corpus of approximately one million reasoning steps across various PDDL domains and use it to train PRMs. Experimental results show that augmenting widely-used PRM training datasets with PDDL-derived data yields substantial improvements in both mathematical and non-mathematical reasoning, as demonstrated across multiple benchmarks. These findings indicate that planning problems constitute a scalable and effective resource for generating robust, precise, and fine-grained training data for PRMs, going beyond the classical mathematical sources that dominate this field.",2026-04-21T02:47:08.086681+00:00
2604.17956v1,Federated Rule Ensemble Method in Medical Data,Ke Wan; Kensuke Tanioka; Toshio Shimokawa,cs.LG; stat.ME,2026-04-20T08:38:26+00:00,2026-04-20T08:38:26+00:00,http://arxiv.org/abs/2604.17956v1,https://arxiv.org/pdf/2604.17956v1,,,"Machine learning has become integral to medical research and is increasingly applied in clinical settings to support diagnosis and decision-making; however, its effectiveness depends on access to large, diverse datasets, which are limited within single institutions. Although integrating data across institutions can address this limitation, privacy regulations and data ownership constraints hinder these efforts. Federated learning enables collaborative model training without sharing raw data; however, most methods rely on complex architectures that lack interpretability, limiting clinical applicability. Therefore, we proposed a federated RuleFit framework to construct a unified and interpretable global model for distributed environments. It integrates three components: preprocessing based on differentially private histograms to estimate shared cutoff values, enabling consistent rule definitions and reducing heterogeneity across clients; local rule generation using gradient boosting decision trees with shared cutoffs; and coefficient estimation via $\ell_1$-regularized optimization using a Federated Dual Averaging algorithm for sparse and consistent variable selection. In simulation studies, the proposed method achieved a performance comparable to that of centralized RuleFit while outperforming existing federated approaches. Real-world analysis demonstrated its ability to provide interpretable insights with competitive predictive accuracy. Therefore, the proposed framework offers a practical and effective solution for interpretable and reliable modeling in federated learning environments.",2026-04-21T02:47:08.086722+00:00
2604.17954v1,Complex normalizing flows can be information Kähler-Ricci flows,Andrew Gracyk,math.DG; cs.LG,2026-04-20T08:36:35+00:00,2026-04-20T08:36:35+00:00,http://arxiv.org/abs/2604.17954v1,https://arxiv.org/pdf/2604.17954v1,,,"We develop interconnections between the complex normalizing flow for data drawn from Borel probability measures on the twofold realification of the complex manifold and the Kähler-Ricci flow. The complex normalizing flow relates the initial and target realified densities under the complex change of variables, necessitating the log determinant of the Wirtinger Jacobian. The Ricci curvature of a Kähler manifold is the second order mixed Wirtinger partial derivative of the log of the local density of the volume form. Therefore, we reconcile these two facts by drawing forth the connection that the log determinant used in the complex normalizing flow matches the Ricci curvature term under differentiation and conditions. The log density under the normalizing flow is kindred to a spatial Fisher information metric under a holomorphic pullback and a Bayesian perspective to the parameter, thus under the continuum limit the log likelihood matches a Fisher metric, recovering the Kähler-Ricci flow up to expectation. Using this framework, we establish other relevant results, attempting to bridge the statistical and ordinary behaviors of the complex normalizing flow to the geometric features of the Kähler-Ricci flow.",2026-04-21T02:47:08.086763+00:00
2604.17948v1,RAVEN: Retrieval-Augmented Vulnerability Exploration Network for Memory Corruption Analysis in User Code and Binary Programs,Parteek Jamwal; Minghao Shao; Boyuan Chen; Achyuta Muthuvelan; Asini Subanya; Boubacar Ballo; Kashish Satija; Mariam Shafey; Mohamed Mahmoud; Moncif Dahaji Bouffi; Pasindu Wickramasinghe; Siyona Goel; Yaakulya Sabbani; Hakim Hacid; Mthandazo Ndhlovu; Eleanna Kafeza; Sanjay Rawat; Muhammad Shafique,cs.CR; cs.AI; cs.MA,2026-04-20T08:29:48+00:00,2026-04-20T08:29:48+00:00,http://arxiv.org/abs/2604.17948v1,https://arxiv.org/pdf/2604.17948v1,,,"Large Language Models (LLMs) have demonstrated remarkable capabilities across various cybersecurity tasks, including vulnerability classification, detection, and patching. However, their potential in automated vulnerability report documentation and analysis remains underexplored. We present RAVEN (Retrieval Augmented Vulnerability Exploration Network), a framework leveraging LLM agents and Retrieval Augmented Generation (RAG) to synthesize comprehensive vulnerability analysis reports. Given vulnerable source code, RAVEN generates reports following the Google Project Zero Root Cause Analysis template. The framework uses four modules: an Explorer agent for vulnerability identification, a RAG engine retrieving relevant knowledge from curated databases including Google Project Zero reports and CWE entries, an Analyst agent for impact and exploitation assessment, and a Reporter agent for structured report generation. To ensure quality, RAVEN includes a task specific LLM Judge evaluating reports across structural integrity, ground truth alignment, code reasoning quality, and remediation quality. We evaluate RAVEN on 105 vulnerable code samples covering 15 CWE types from the NIST-SARD dataset. Results show an average quality score of 54.21%, supporting the effectiveness of our approach for automated vulnerability documentation.",2026-04-21T02:47:08.086823+00:00
2604.17935v1,How Much Cache Does Reasoning Need? Depth-Cache Tradeoffs in KV-Compressed Transformers,Xiao Wang,cs.LG; cs.AI; cs.CC,2026-04-20T08:15:17+00:00,2026-04-20T08:15:17+00:00,http://arxiv.org/abs/2604.17935v1,https://arxiv.org/pdf/2604.17935v1,,,"The key-value (KV) cache is the dominant memory bottleneck during Transformer inference, yet little is known theoretically about how aggressively it can be compressed before multi-step reasoning degrades. We study this through $k$-hop pointer chasing on $n$ tokens under a shared KV cache of size $s$, attention dimension $m$, $H$ heads, $p$-bit precision, and a locality-respecting cache controller (satisfied by all standard KV-compression methods). We give three results.   (1) Product depth lower bound (conjectured). We conjecture that any such Transformer ($n \geq 4k$, $s \leq \sqrt{n}/4$) requires depth $L = Ω(\lceil k/s \rceil \cdot \lceil \log_2 n/(Hmp) \rceil)$, and isolate the sole remaining gap as a probabilistic step on the joint distribution of cache trace and pointer chain. Unconditionally, we prove a matching upper bound $L = O(\min(k, \lceil k/s \rceil \log s) \cdot \log n/(mp))$ via windowed pointer doubling, and a max-bound $L = Ω(\max(\lceil k/s \rceil, \log n/(Hmp)))$. Closing the conjecture amounts to upgrading max to product.   (2) Bandwidth barrier. The product bound binds only when $Hmp \lesssim \log n$. Any lower bound provable via per-window distinguishability counting -- including reachability, bandwidth, and combinations -- cannot exceed $\lceil k/s \rceil$ once $Hmp \geq \log_2 n$. Breaking this requires lifting unconditional communication-complexity bounds for pointer chasing to Cache-Transformer depth.   (3) Adaptive vs oblivious error scaling. Under random cache over $T = \lceil \log_2 k \rceil$ doubling stages, oblivious caches give $\Pr[\mathcal{E}] \leq (s/(n-T))^T + 2T^3/n$ (exponential in $T$), while adaptive locality-respecting caches achieve $\Pr[\mathcal{E}] = s/n$ exactly, independent of $T$. The $Ω((n/s)^{T-1})$ separation explains why heavy-hitter eviction empirically dominates random eviction for multi-hop reasoning.",2026-04-21T02:47:08.086864+00:00
2604.17930v1,Heterogeneity in Formal Linguistic Competence of Language Models: Is Data the Real Bottleneck?,H S V N S Kowndinya Renduchintala; Sumit Bhatia,cs.CL; cs.AI; cs.LG,2026-04-20T08:11:04+00:00,2026-04-20T08:11:04+00:00,http://arxiv.org/abs/2604.17930v1,https://arxiv.org/pdf/2604.17930v1,,,"Large Language Models (LLMs) exhibit a puzzling disparity in their formal linguistic competence: while they learn some linguistic phenomena with near-perfect mastery, they often perform below chance on others, even after training on trillions of tokens. In this work, we investigate whether these failures stem from inherent architectural limitations or simply the scarcity of these specific grammatical constructions in web-scale corpora. We pre-train simple GPT-2 Small (124M) models on a 100M-token random sample of the FineWeb corpus and intervene by injecting a minimal amount (1%) of synthetic data targeting specific linguistic phenomena. We find that this targeted intervention substantially improves model performance in 8 out of the 9 worst-performing BLiMP paradigms - notably the accuracy on a specific paradigm, only_npi_scope, surges from 20.9% to 69.4%. Furthermore, we observe that these interventions generally preserve or slightly improve aggregate performance. However, while we also identify a resistant phenomenon, principle_A_c_command, whose performance remains below chance even after our data augmentation, our findings do serve as an optimistic existence proof that even small language models can substantially improve on those linguistic phenomena on which models typically perform poorly, provided the pre-training data contains sufficient exposure to them. This suggests that efforts towards human-scale language modeling may benefit greatly by focusing on data composition. The code to reproduce our results is open-sourced at https://github.com/kowndinya-renduchintala/heterogeneity-in-formal-linguistic-competence.",2026-04-21T02:47:08.086904+00:00
