arxiv_id,title,authors,categories,published,updated,url,pdf_url,doi,journal_ref,abstract,collected_at
2606.18246v1,Variable-Width Transformers,Zhaofeng Wu; Oliver Sieberling; Shawn Tan; Rameswar Panda; Yury Polyanskiy; Yoon Kim,cs.CL,2026-06-16T17:59:03+00:00,2026-06-16T17:59:03+00:00,http://arxiv.org/abs/2606.18246v1,https://arxiv.org/pdf/2606.18246v1,,,"Scaling model size, specifically depth and width, has driven significant progress in transformer-based language models. However, most architectures maintain a constant width across all layers, allocating a fixed parameter and computation budget evenly despite different layers potentially playing distinct computational roles. In this work, we empirically investigate nonuniform capacity allocation across network depth by proposing a $\times$-shaped > <former architecture. This design maintains wider early and late layers while narrowing the middle layers, utilizing a parameter-free residual resizing mechanism. Across decoder-only language models ranging from 200M to 2B parameters (dense) and 3B parameters (MoE), our > <former consistently outperforms parameter-matched uniform baselines on language modeling loss. By reducing the average layer width, this architecture also requires fewer overall FLOPs (22% reduction under fitted loss-matched scaling curves) and smaller KV cache memory and I/O cost (15% reduction). In analysis, we show that this bottleneck structure results in qualitatively different representations in residual streams. Overall, our results demonstrate that nonuniform width allocation can result in more resource-optimal scaling of language models.",2026-06-17T04:18:18.409590+00:00
2606.18237v1,ReproRepo: Scaling Reproducibility Audits with GitHub Repository Issues,Shanda Li; Qiuhong Anna Wei; Jingwu Tang; Valerie Chen; Nihar B Shah; Tim Dettmers; Yiming Yang; Ameet Talwalkar,cs.CL; cs.AI; cs.LG,2026-06-16T17:58:05+00:00,2026-06-16T17:58:05+00:00,http://arxiv.org/abs/2606.18237v1,https://arxiv.org/pdf/2606.18237v1,,,"Reproducing research results from papers and released code is central to scientific progress. Existing works have introduced benchmarks to evaluate whether LLM agents can assist with reproducibility, but they are difficult to scale due to their reliance on substantial manual effort for data curation and evaluation. We introduce ReproRepo, a scalable framework for reproducibility evaluation that leverages human-raised GitHub issues as naturally occurring supervision on realistic reproduction blockers. We instantiate ReproRepo on 1,149 recent machine learning papers from major conferences and evaluate four frontier model-agent configurations. Our results show that LLM agents, even without executing code, can identify many real-world reproducibility problems from paper-repository pairs: the best agent in our study, namely Codex with GPT-5.5, surfaces at least one semantically related human-reported blocker for ~90% of papers in the study. Further analysis shows that agents are particularly effective for surfacing visible failures and identifying the right semantic region, but may still be insufficient in exact localization. ReproRepo can serve as a reusable, scalable framework for future evaluations of LLM agents on real-world reproducibility auditing. Our code is released at https://github.com/LithiumDA/ReproRepo.",2026-06-17T04:18:18.409604+00:00
2606.18236v1,"Sign-Rank, Index, and List Replicability: Connections and Separations",Ari Blondal; Hamed Hatami; Pooya Hatami; Chavdar Lalov; Sivan Tretiak,cs.LG; cs.IT,2026-06-16T17:57:16+00:00,2026-06-16T17:57:16+00:00,http://arxiv.org/abs/2606.18236v1,https://arxiv.org/pdf/2606.18236v1,,,"In learning theory, the sign rank of a binary concept class captures the smallest dimension in which it can be represented by points and halfspaces. Despite tremendous interest, lower bounds on sign rank are notoriously difficult to come by. Two recent approaches to the problem establish lower bounds on sign rank by measures that are easier to analyze: the $\mathbb{Z}_2$-index and the list replicability number.   We order these measures, showing that the $\mathbb{Z}_2$-index is upper-bounded by a linear function of the list replicability number. As a main consequence, we obtain a strong separation between sign rank and $\mathbb{Z}_2$-index, thereby resolving a question of Frick, Hosseini, and Vasileuski.   This motivates a thorough study of list replicability, the stronger of the two lower-bounding measures. We establish upper bounds on the list replicability number by two combinatorial measures: height and minimum star number. We also prove a fundamental composition result, showing that the product of two concept classes has list replicability number bounded by the sum of the list replicability numbers of the two classes.",2026-06-17T04:18:18.409614+00:00
2606.18231v1,Adaptive Volumetric Mechanical Property Fields Invariant to Resolution,Rishit Dagli; Donglai Xiang; Vismay Modi; Xuning Yang; Gavriel State; David I. W. Levin; Maria Shugrina,cs.CV; cs.LG; cs.RO,2026-06-16T17:56:03+00:00,2026-06-16T17:56:03+00:00,http://arxiv.org/abs/2606.18231v1,https://arxiv.org/pdf/2606.18231v1,,,"Accurate mechanical properties (or materials) Young's modulus ($E$), Poisson's ratio ($ν$) and density ($ρ$) are essential for reliable physics simulation of digital worlds, but most 3D assets lack this information. We propose AdaVoMP, a method for predicting accurate dense spatially-varying ($E$, $ν$, $ρ$) for input 3D objects across representations, improving the resolution, accuracy, and memory efficiency over the state-of-the-art. The foundation of our technique is a sparse and adaptive voxel structure SAV that efficiently represents both the input 3D shape and the material field output. We replace the fixed-voxel model of the most accurate prior method, VoMP, with a novel sparse transformer encoder-decoder model that learns to generate a unique SAV autoregressively for every input shape to represent its materials, achieving a resolution $16^3\times$ higher than prior art. Experiments show that AdaVoMP estimates more accurate volumetric properties, even with lesser test-time compute than all prior art. This allows us to convert high-resolution complex 3D objects into simulation-ready assets, resulting in realistic deformable simulations.",2026-06-17T04:18:18.409624+00:00
2606.18223v1,Learning Red Agent Policy from Observations for Neurosymbolic Autonomous Cyber Agents,Ankita Samaddar; Sandeep Neema; Daniel Balasubramanian; Xenofon Koutsoukos,cs.CR; cs.AI; cs.LG; eess.SY,2026-06-16T17:50:41+00:00,2026-06-16T17:50:41+00:00,http://arxiv.org/abs/2606.18223v1,https://arxiv.org/pdf/2606.18223v1,,,"With sophisticated cyber-attacks becoming increasingly prevalent, modern networks require intelligent autonomous cyber-defense agents trained via Reinforcement Learning (RL). These agents employ neurosymbolic approaches such as behavior trees with learning-enabled components (LECs) to learn, reason, adapt, and implement security rules while maintaining critical operations. However, these autonomous networks are partially observable systems, i.e., the cyber-attacker's (red agent's) actions are not observable, making it difficult for the defender to predict red actions, learn red policies, or assess the attacker's intrusion levels. To address this, we propose a Policy Learning Technique using imitation learning to learn policies for partially observable RL agents with discrete states and discrete actions. We apply this technique in an autonomous cyber environment to predict red agent's actions from network observations and defender actions. Integrated with a neurosymbolic cyber-defense agent, our method effectively handles different red policies and achieves high prediction accuracy across diverse simulated scenarios.",2026-06-17T04:18:18.409637+00:00
2606.18222v1,"Darshana Graph: A Parallel Commentary Corpus for Comparative Indian Philosophy, with Stylometric and Exploratory Graph Analyses",Joy Bose,cs.CL; cs.DL,2026-06-16T17:49:15+00:00,2026-06-16T17:49:15+00:00,http://arxiv.org/abs/2606.18222v1,https://arxiv.org/pdf/2606.18222v1,,,"We introduce Darshana Graph, a corpus of over 125,000 text records spanning classical Hindu, Buddhist, and Jain philosophical traditions, drawn from public-domain and openly licensed translations of sources including the Bhagavad Gita, Brahma Sutras, principal Upanishads, the Pali Canon, and core Jain texts. Its distinctive contribution lies in a structurally unique subset of roughly 8,500 Hindu and Jain records in which the same root verse or sutra is aligned across eighteen historical commentators representing five schools of Vedanta and other darshanas, enabling direct comparison of how independent interpretive traditions read identical source material. To our knowledge, no publicly available resource provides comparable cross-commentator alignment at this scale. We present two analyses built on this corpus. First, a transparent stylometric comparison requiring no machine learning measures argumentative style through scriptural citation density, explicit refutation rate, and sentence complexity. It finds a moderate negative correlation between citation density and refutation rate, a marked increase in refutation rate across three commentators in a related doctrinal lineage, and measurable genre-level differences within the Pali Canon itself. Second, we describe a constrained large language model pipeline that extracts typed philosophical relationships between concepts using a predefined relation vocabulary and deterministic post-hoc validation. The resulting graph surfaces cross-school disagreement patterns while also revealing important extraction limitations, including cases where an independent embedding-based analysis disagrees with the graph-derived findings. We release the full corpus, extracted relationship graph, and all source code.",2026-06-17T04:18:18.409644+00:00
2606.18218v1,Finite-Time Queue Peak Laws in Stochastic Networks: Logarithmic Scaling After Geometric Thresholds,Hao Liang; Cheng Tang; Yunzong Xu,math.PR; cs.LG; eess.SY; math.OC; stat.ML,2026-06-16T17:47:47+00:00,2026-06-16T17:47:47+00:00,http://arxiv.org/abs/2606.18218v1,https://arxiv.org/pdf/2606.18218v1,,,"We study finite-horizon queue peaks in generalized switches, a standard stochastic-network model in which many queues share constrained service resources. Arrivals may be dependent, time-varying, and adapted to the past; the standing load condition is uniform interior slack, meaning the conditional mean arrival vector stays in a fixed contraction of the capacity region. We show that this slack reshapes the finite-time peak law for drift-minimizing scheduling policies such as MaxWeight. The square-root envelope that is sharp without slack persists only up to a geometry-dependent threshold; beyond that threshold, the running maximum grows only logarithmically with the horizon, both with high probability and in expectation.   The mechanism is self-normalization: in the current queue direction, the projected fluctuation scale is normalized by the stabilizing drift scale. This removes capacity geometry from the logarithmic coefficient, while geometry remains in the threshold. Matching lower bounds show that both the logarithmic term and a geometric threshold are unavoidable. When finite-time state-space collapse is available, the threshold can be sharpened using local bottleneck geometry. For generalized input-queued switches, we obtain finite-time peak bounds with tight logarithmic coefficients. Simulations illustrate the two-phase envelope, local geometric refinements, and variance-sensitive improvements predicted by the theory.",2026-06-17T04:18:18.409653+00:00
2606.18209v1,Rethinking Dataset Distillation for Classification: Do Distilled Sets Outperform Coresets?,Trisha Mittal; Akshay Mehra; Joshua Kimball,cs.LG,2026-06-16T17:37:49+00:00,2026-06-16T17:37:49+00:00,http://arxiv.org/abs/2606.18209v1,https://arxiv.org/pdf/2606.18209v1,,,"Dataset distillation (DD) has emerged as a prominent approach in data centric machine learning, aiming to synthesize compact training sets for efficient training by compressing the information in large datasets into a small number of synthetic samples. However, DD methods are often evaluated under inconsistent evaluation protocols, ranging from standard ERM to single/multi-teacher supervision, making it difficult to isolate the effectiveness of distilled data from evaluation. Moreover, many prior methods claim that DD outperforms data pruning approaches such as coreset selection (CS), based on the assumption that restricting condensed datasets to subsets of real samples fundamentally limits their expressiveness. In this work, we critically evaluate DD methods through large-scale experiments using standardized datasets and evaluation protocols to assess their intrinsic effectiveness. We benchmark seven state-of-the-art (SOTA) DD methods on ImageNet-1K, ImageNet100, and ImageNette, using three widely adopted training protocols against three CS strategies. Our results show that while some DD methods fail to outperform even simple random subsets, the SOTA DD approaches are comparable to or worse than coresets on large-scale datasets and incur a substantially higher cost for construction. Beyond accuracy, we also evaluate the representativeness, diversity, and quality of condensed sets, and find that coresets consistently achieve better coverage of the original data distribution. These findings highlight the limited practical advantages of current DD methods and show that coresets remain competitive and are often a more computationally efficient alternative for data-centric learning.",2026-06-17T04:18:18.409666+00:00
2606.18208v1,Looped World Models,Hongyuan Adam Lu; Z. L. Victor Wei; Qun Zhang; Jinrui Zeng; Bowen Cao; Lingwei Meng; Mocheng Li; Zezhong Wang; Haonan Yin; Naifu Xue; Minyu Chen; Cenyuan Zhang; Zefan Zhang; Hao Wei; Jiawei Zhou; Haoran Xu; Hao Yang; Ronglai Zuo; Tongda Xu; Yonghao Li; Jian Chen; Hebin Wang; Zeyu Gao; Yang Li; Wei Zhao; Qimin Zhong; Siqi Liu; Yumeng Zhang; Leyan Cui; Zhangyu Wang; Wai Lam,cs.LG; cs.AI; cs.CL; cs.CV,2026-06-16T17:37:27+00:00,2026-06-16T17:37:27+00:00,http://arxiv.org/abs/2606.18208v1,https://arxiv.org/pdf/2606.18208v1,,,"Current world models face a fundamental tension: faithful long-horizon simulation demands deep computation, but deeper models are expensive to deploy and prone to compounding errors. We resolve this by introducing Looped World Models (LoopWM), which are the first looped architectures for world modelling. Our method iteratively refines latent environment states through a parameter-shared transformer block. This yield up to 100x parameter efficiency over conventional approaches with adaptive computation that automatically scales depth to match the complexity of each prediction step. Orthogonal to scaling model size and training data, LoopWM establishes iterative latent depth as a new scaling axis for world simulation, which might significantly push the community forward.",2026-06-17T04:18:18.409675+00:00
2606.18206v1,Fixed-Point Reasoners: Stable and Adaptive Deep Looped Transformers,Sajad Movahedi; Vera Milovanović; Shlomo Libo Feigin; Alexander Theus; Thomas Hofmann; Valentina Boeva; T. Konstantin Rusch; Antonio Orvieto,cs.AI,2026-06-16T17:36:33+00:00,2026-06-16T17:36:33+00:00,http://arxiv.org/abs/2606.18206v1,https://arxiv.org/pdf/2606.18206v1,,,"Looped architectures provide an inductive bias toward learning step-by-step procedures for tasks that require compositional reasoning. The number of effective layers reached by looping determines the quality of the solution these models find. Like deep architectures, looped architectures are prone to a signal propagation problem induced by depth as the halting decision is postponed. In this paper, we address this signal propagation issue using pre-norm layers and residual scaling. Building on these architectural modifications, we propose FPRM, a Transformer-based Fixed-Point Reasoning Model that uses fixed-point convergence as an end-to-end halting mechanism in a looped architecture. We show that fixed-point halting allows FPRM to adapt its compute to task difficulty. FPRM is effective on common reasoning benchmarks, namely Sudoku, Maze, state-tracking, and ARC-AGI.",2026-06-17T04:18:18.409683+00:00
2606.18205v1,Analyzing and Encoding the Al-Mawrid Arabic-English Dictionary with the ISO Language Markup Framework and TEI Lex-0,Diaa Fayed; Laurent Romary,cs.CL,2026-06-16T17:35:11+00:00,2026-06-16T17:35:11+00:00,http://arxiv.org/abs/2606.18205v1,https://arxiv.org/pdf/2606.18205v1,,,"This paper presents a robust methodology for the systematic digitization and encoding of the Al-Mawrid Arabic-English dictionary, transforming it from a legacy print resource into a standardized computational lexicon. Addressing a significant gap in Arabic lexical infrastructure, the study adopts a dual-standard framing that aligns the ISO Lexical Markup Framework (LMF) with the Text Encoding Initiative TEI Lex-0 guidelines. By applying an editorial view to the dictionary's macro- and microstructure, the research resolves the structural ambiguities and punctuation inconsistencies typical of 20th-century bilingual dictionaries. The methodology is grounded in an empirical analysis of the dictionary's lexical knowledge density. Drawing on a representative sample (the letter Ayn, comprising 4.6% of the total volume), the study provides scientific weight to the encoding process, demonstrating a structural parsing accuracy of 91%. Quantitative evaluation of the information extraction rules reveals high performance, with 85% precision and 98% recall for synonyms, and 88% precision for other morpho-semantic features. Beyond technical description, the paper provides a critical comparison with existing Arabic lexical resources and discusses the limitations of TEI Lex-0 when modelling specific Arabic phenomena, such as implicit ""open set"" semantic relations and scattered morphological cues. Furthermore, the study explores the potential for Linguistic Linked Open Data (LLOD) integration by establishing a scalable prefix-based referencing system that facilitates the resource's inclusion in the semantic web. The result is an interoperable, machine-tractable resource that provides a reproducible workflow for the retro-digitization of complex legacy bilingual lexicons within the Arabic NLP and Digital Humanities communities.",2026-06-17T04:18:18.409691+00:00
2606.18195v1,Learning from the Self-future: On-policy Self-distillation for dLLMs,Yifu Luo; Zeyu Chen; Haoyu Wang; Xinhao Hu; Yuxuan Zhang; Zhizhou Sha; Shiwei Liu,cs.CL,2026-06-16T17:24:57+00:00,2026-06-16T17:24:57+00:00,http://arxiv.org/abs/2606.18195v1,https://arxiv.org/pdf/2606.18195v1,,,"On-policy self-distillation (OPSD) has proven effective for post-training large language models (LLMs), yet its application to diffusion LLMs (dLLMs) remains unexplored. Existing OPSD methods are inherently autoregressive-centric. They inject privileged information via left-to-right prefix conditioning with token-level divergence supervision, a design that fundamentally conflicts with the arbitraryorder generation of dLLMs. We introduce d-OPSD, the first OPSD framework tailored for dLLMs. Our approach makes two core contributions. First, we reframe self-teacher construction by using self-generated answers as suffix conditioning, enabling the student model to learn from ""self future-experience"" rather than privileged prefixes. Second, we shift supervision from token-level to step-level, aligning training with the iterative denoising process of dLLMs. Experiments across four reasoning benchmarks show that d-OPSD consistently outperforms RLVR and SFT baselines with superior sample efficiency, requiring only around 10% of the optimization steps by RLVR and opening a promising pathway for dLLM posttraining. The code is available at https://github.com/xingzhejun/d-OPSD.",2026-06-17T04:18:18.409697+00:00
2606.18193v1,A Red-Team Study of Anthropic Fable 5 & Opus 4.8 Models,Nicola Franco,cs.CR; cs.AI; cs.CL,2026-06-16T17:23:58+00:00,2026-06-16T17:23:58+00:00,http://arxiv.org/abs/2606.18193v1,https://arxiv.org/pdf/2606.18193v1,,,"We evaluate the adversarial robustness of two frontier large language models (LLMs) developed by Anthropic, Fable 5 and Opus 4.8, against four families of automated jailbreak attack across 7 826 harmful intents spanning a ten-category harm taxonomy. Using the HackAgent red-teaming framework, hundreds of thousands of adversarial attempts were generated and every apparent success was independently re-adjudicated by a panel of three judge models (majority vote). Both models resist the majority of attacks, but the residual surface is larger than aggregate framing suggests: it is dominated by adaptive iterative attacks, while static obfuscation is near-fully neutralised. The strongest adaptive search (tree-of-attacks) breaks Opus 4.8 on 11.5% of intents overall, whereas Fable 5 stays in the single digits (6.1% worst-case). Aggregate rates therefore should not be read as reassurance. Even in these hardened configurations, the two models produced 1 620 (Opus 4.8) and 702 (Fable 5) panel-confirmed harmful completions spanning every harm category, located automatically, cheaply, and within the first one or two refinement steps by an attacker model with no human expert in the loop. The reasonable conclusion is that even the best, most-tested frontier models remain reliably breakable under sustained automated pressure.",2026-06-17T04:18:18.409701+00:00
2606.18192v1,The Stanford EDGAR Filings Dataset: Reconstructing U.S. Corporate and Financial Disclosures into Layout-Faithful and Token-Efficient Pretraining Data,Nick Bettencourt; Xiaowei Ding; Kay Giesecke,cs.AI,2026-06-16T17:22:34+00:00,2026-06-16T17:22:34+00:00,http://arxiv.org/abs/2606.18192v1,https://arxiv.org/pdf/2606.18192v1,,,"As high-quality public web corpora become increasingly exhausted, clean long-context documents have become a scarce and expensive source of training data for large language models (LLMs). Existing long-context corpora are often proprietary and costly to acquire, synthetically generated, or concentrated in narrow domains such as programming. We introduce the Stanford EDGAR Filings Dataset (SEFD), an open reconstruction of SEC filings into layout-faithful MultiMarkdown for financial language modeling and evaluation. SEFD makes audited financial statements, risk disclosures, ownership reports, accounting notes, and market-moving event filings usable as long-context pretraining data and as a basis for financial reasoning, forecasting, compliance, and document understanding. The resulting corpus is token-efficient, model-ready, and has less than 0.1% overlap with Common Crawl-derived corpora. We release SEFD-v1, a 152B-token initial public snapshot, and provide corpus-level analyses of a larger 18.5M-filing archive estimated at 550B tokens. We further introduce two SEFD-derived benchmarks: EDGAR-Forecast, which evaluates filing-grounded numerical forecasting after model knowledge cutoffs, and EDGAR-OCR, which evaluates transcription of complex financial tables.",2026-06-17T04:18:18.409706+00:00
2606.18190v1,Multi-Source Cybersecurity Logs: An ATT&CK-Labeled Dataset and SLM Evaluation,Abir Ashab Niloy; Ahmed Ryan; Imamul Hossain Rafi; Md Erfan; Md Rayhanur Rahman,cs.CR; cs.LG,2026-06-16T17:21:58+00:00,2026-06-16T17:21:58+00:00,http://arxiv.org/abs/2606.18190v1,https://arxiv.org/pdf/2606.18190v1,,,"Multi-stage cyberattacks span system, network, and browser logs. Detecting them requires correlating events across all three sources. Machine learning methods can learn these cross-source patterns, but they need labeled multi-source data. Existing public datasets fall short. Network-only datasets such as CICIDS and UNSW-NB15 miss host and browser activity. Host-focused datasets such as LMDG and CICAPT-IIoT lack browser telemetry. ATLAS includes all three sources but labels events only as malicious or benign, without MITRE Adversarial Tactics, Techniques, and Common Knowledge (ATT&CK) technique granularity. No public dataset combines all three sources with per-entry ATT&CK technique labels. We close the gap by building a multi-source log dataset of 870 sessions (70 attack, 800 benign) and approximately 2.3 million events. We captured system, network, and browser activity simultaneously on Windows endpoints. We labeled malicious events with ATT&CK technique IDs, covering 12 tactics and 53 techniques. We generated all attack data using real tools, including Remote Access Trojan (RAT), Command and Control (C2) tunnels, and cloud exfiltration. To demonstrate learnability, we fine-tuned three Small Language Models (SLMs) (Qwen2.5-1.5B, Llama-3.2-3B, Phi-4-Mini) using Low-Rank Adaptation (LoRA). We compared each against its base variant across ten metrics on two tasks: chunk classification and ATT&CK technique identification. Fine-tuning improved every model on every metric. Chunk classification accuracy rose from approximately 8% in the base variants to between 90% and 97% after fine-tuning. Technique identification remained challenging, with the best exact-match accuracy at 42%, although high partial-match scores show the models captured most of the underlying reasoning.",2026-06-17T04:18:18.409713+00:00
